"Cookies, sugar, prepared from recipe, made with margarine",60,1.2,24.86,28.35,"1 oz",14,"1 cookie,  (3"" dia)"
"Cookies, sugar wafers with creme filling, regular",70.64,1.6,42.95,36,"3 cookies",10.1,"1 cookie"
"Cookies, vanilla sandwich with creme filling",72.1,1.5,39.3,28.35,"1 oz",15,"1 cookie, oval (3-1/8"" x 1-1/4"" x 3/8"")"
"Puff pastry, frozen, ready-to-bake, baked",45.7,1.5,0.75,28.35,"1 oz",245,"1 sheet"
"Cookies, vanilla wafers, lower fat",73.6,1.9,37.5,28.35,"1 oz",80,"1 cup, crumbs"
"Cookies, vanilla wafers, higher fat",71.1,2,,28.35,"1 oz",6,"1 wafer"
"Crackers, cheese, regular",59.42,2.3,4.53,14.2,".5 oz",62,"1 cup, bite size"
"Crackers, cheese, sandwich-type with peanut butter filling",56.74,3.4,6.98,14.2,".5 oz",83,"1 cup, crushed"
"Crackers, crispbread, rye",82.2,16.5,1.07,14.2,".5 oz",55,"1 cup, crushed"
"Crackers, matzo, plain",83.7,3,0.29,14.2,".5 oz",28,"1 matzo"
"Crackers, matzo, egg",78.6,2.8,,14.2,".5 oz",28,"1 matzo"
"Crackers, matzo, whole-wheat",78.9,11.8,,14.2,".5 oz",28,"1 matzo"
"Crackers, melba toast, plain",76.6,6.3,0.94,14.2,".5 oz",30,"1 cup, pieces"
"Crackers, melba toast, rye (includes pumpernickel)",77.3,8,,14.2,".5 oz",5,"1 toast"
"Crackers, melba toast, wheat",76.4,7.4,,14.2,".5 oz",5,"1 toast"
"Crackers, milk",69.7,1.9,16.44,14.2,".5 oz",11,"1 cracker"
"Crackers, rusk toast",72.3,,,14.2,".5 oz",10,"1 rusk"
"Crackers, rye, sandwich-type with cheese filling",60.8,3.6,,14.2,".5 oz",7,"1 cracker,  sandwich"
"Crackers, rye, wafers, plain",80.4,22.9,1.01,14.2,".5 oz",61,"1 cup, crushed"
"Crackers, rye, wafers, seasoned",73.8,20.9,,14.2,".5 oz",22,"1 cracker,  triple"
"Crackers, saltines (includes oyster, soda, soup)",74.34,2.9,2.22,14.2,".5 oz",70,"1 cup, crushed"
"Crackers, standard snack-type, regular",61.37,2.1,7.45,16,"5 crackers, regular size, round (1 serving)",3.2,"1 cracker, round"
"Crackers, standard snack-type, sandwich, with cheese filling",61.7,1.9,3.18,14.2,".5 oz",7,"1 cracker,  sandwich"
"Crackers, standard snack-type, sandwich, with peanut butter filling",58.38,2.3,10.5,14.2,".5 oz",7,"1 cracker,  sandwich"
"Crackers, wheat, regular",67.35,3.7,13.8,31,"1 serving",2,"1 cracker,  thin square"
"Crackers, wheat, sandwich, with cheese filling",58.2,3.1,,14.2,".5 oz",7,"1 cracker,  sandwich"
"Crackers, wheat, sandwich, with peanut butter filling",53.8,4.4,,14.2,".5 oz",7,"1 cracker,  sandwich"
"Crackers, whole-wheat",69.55,10.3,1.19,28,"1 serving",28,"6 crackers, Triscuits, regular size"
"Cracker meal",80.9,2.6,0.33,28.35,"1 oz",115,"1 cup"
"Cream puffs, prepared from recipe, shell (includes eclair)",22.8,0.8,0.43,28.35,"1 oz",48,"1 eclair,  (5"" x 2"" x 1-3/4"")"
"Cream puffs, prepared from recipe, shell, with custard filling",22.9,0.4,9.49,28.35,"1 oz",130,"1 cream puff"
"Croissants, butter",45.8,2.6,11.26,28.35,"1 oz",28,"1 croissant,  mini"
"Croissants, apple",37.1,2.5,,28.35,"1 oz",57,"1 croissant,  medium"
"Croissants, cheese",47,2.6,11.35,28.35,"1 oz",42,"1 croissant,  small"
"Croutons, plain",73.5,5.1,,14.2,".5 oz",30,"1 cup"
"Croutons, seasoned",63.5,5,4.41,14.2,".5 oz",40,"1 cup"
"Danish pastry, cinnamon, enriched",44.6,1.3,19.78,28.35,"1 oz",142,"1 large,  (approx 7"" dia)"
"Danish pastry, cheese",37.2,1,6.95,28.35,"1 oz",71,"1 pastry"
"Danish pastry, fruit, enriched (includes apple, cinnamon, raisin, lemon, raspberry, strawberry)",47.8,1.9,27.53,28.35,"1 oz",142,"1 large,  (approx 7"" dia)"
"Danish pastry, nut (includes almond, raisin nut, cinnamon nut)",45.7,2,25.87,28.35,"1 oz",65,"1 pastry,  (4-1/4"" dia)"
"Doughnuts, cake-type, plain (includes unsugared, old-fashioned)",45.63,1.6,16.28,28.35,"1 oz",52,"1 doughnut, stick"
"Doughnuts, cake-type, plain, chocolate-coated or frosted",51.33,1.9,26.65,28.35,"1 oz",18,"1 donettes,  (2"" dia)"
"Doughnuts, cake-type, plain, sugared or glazed",50.8,1.5,,28.35,"1 oz",45,"1 doughnut,  medium (approx 3"" dia)"
"Doughnuts, cake-type, chocolate, sugared or glazed",57.4,2.2,31.92,28.35,"1 oz",60,"1 doughnut,  (3-3/4"" dia)"
"Doughnuts, cake-type, wheat, sugared or glazed",42.6,2.2,21.58,28.35,"1 oz",28,"1 doughnut,  (2"" dia)"
"Doughnuts, french crullers, glazed",59.5,1.2,35.11,28.35,"1 oz",41,"1 cruller,  (3"" dia)"
"Doughnuts, yeast-leavened, with creme filling",30,0.8,14.55,28.35,"1 oz",85,"1 doughnut, oval (3-1/2"" x 2-1/2"")"
"Doughnuts, yeast-leavened, glazed, enriched (includes honey buns)",50.64,2.1,19.52,28.35,"1 oz",13,"1 doughnut, hole"
"Doughnuts, yeast-leavened, with jelly filling",39,0.9,21.1,28.35,"1 oz",85,"1 doughnut, oval (3-1/2"" x 2-1/2"")"
"Eclairs, custard-filled with chocolate glaze, prepared from recipe",24.2,0.6,6.6,28.35,"1 oz",112,"1 cream puff,  (3-1/2"" x 2"")"
"English muffins, plain, enriched, with ca prop (includes sourdough)",44.17,3.5,3.53,28.35,"1 oz",57,"1 muffin"
"English muffins, plain, toasted, enriched, with calcium propionate (includes sourdough)",52.65,2.8,3.47,28.35,"1 oz",52,"1 muffin"
"English muffins, mixed-grain (includes granola)",46.3,2.8,0.81,28.35,"1 oz",66,"1 muffin"
"English muffins, mixed-grain, toasted (includes granola)",50.3,3,0.88,28.35,"1 oz",61,"1 muffin"
"English muffins, raisin-cinnamon (includes apple-cinnamon)",48.1,2.6,14.76,28.35,"1 oz",57,"1 muffin"
"English muffins, raisin-cinnamon, toasted (includes apple-cinnamon)",55.04,3,13.34,28.35,"1 oz",52,"1 muffin"
"English muffins, wheat",44.8,4.6,1.56,28.35,"1 oz",57,"1 muffin"
"English muffins, wheat, toasted",48.7,5,1.7,28.35,"1 oz",52,"1 muffin"
"English muffins, whole-wheat",40.4,6.7,8.09,28.35,"1 oz",66,"1 muffin"
"English muffins, whole-wheat, toasted",44.1,7.3,8.79,28.35,"1 oz",61,"1 muffin"
"French toast, frozen, ready-to-heat",32.1,1.1,,28.35,"1 oz",59,"1 piece"
"French toast, prepared from recipe, made with low fat (2%) milk",25,,,28.35,"1 oz",65,"1 slice"
"Hush puppies, prepared from recipe",46,2.8,2.03,28.35,"1 oz",152,"1 cup"
"Ice cream cones, cake or wafer-type",79,3,6,28.35,"1 oz",4,"1 cone"
"Ice cream cones, sugar, rolled-type",84.1,1.7,25.66,28.35,"1 oz",10,"1 cone"
"Muffins, plain, prepared from recipe, made with low fat (2%) milk",41.4,2.7,,28.35,"1 oz",57,"1 muffin"
"Muffins, blueberry, commercially prepared (Includes mini-muffins)",49.54,1.7,27.05,28.35,"1 oz",17,"1 mini,  (1-1/4"" dia)"
"Muffins, blueberry, dry mix",63.2,,,28.35,"1 oz",356,"1 package,  mix + drained berries"
"Muffins, blueberry, toaster-type",53.3,1.8,4.85,28.35,"1 oz",33,"1 muffin,  toaster"
"Muffins, blueberry, prepared from recipe, made with low fat (2%) milk",40.7,,,28.35,"1 oz",57,"1 muffin"
"Muffins, corn, commercially prepared",50.9,3.4,7.5,28.35,"1 oz",17,"1 mini"
"Muffins, corn, dry mix, prepared",49.1,2.4,,28.35,"1 oz",,
"Muffins, corn, toaster-type",57.9,1.6,,28.35,"1 oz",33,"1 muffin,  toaster"
"Muffins, corn, prepared from recipe, made with low fat (2%) milk",44.2,,,28.35,"1 oz",57,"1 muffin,  (2-3/4"" dia x 2"")"
"Muffins, oat bran",48.3,4.6,8.22,28.35,"1 oz",17,"1 mini"
"Muffins, wheat bran, dry mix",73,,,28.35,"1 oz",198,"1 package,  (7 oz)"
"Muffins, wheat bran, toaster-type with raisins",52.2,7.7,13.98,28.35,"1 oz",36,"1 muffin,  toaster"
"Pancakes plain, frozen, ready-to-heat (includes buttermilk)",39.29,2.4,9.73,28.35,"1 oz",41,"1 pancake"
"Pancakes, plain, dry mix, complete (includes buttermilk)",73.65,2.5,16.03,52,".333 cup",28.35,"1 oz"
"Pancakes, plain, dry mix, complete, prepared",36.7,1.3,,28.35,"1 oz",38,"1 pancake,  (4"" dia)"
"Pancakes, plain, dry mix, incomplete (includes buttermilk)",73.6,5.4,2.21,28.35,"1 oz",112,"1 cup,  poured from box"
"Pancakes, plain, dry mix, incomplete, prepared",28.9,1.9,,28.35,"1 oz",38,"1 pancake,  (4"" dia)"
"Pancakes, plain, prepared from recipe",28.3,,,28.35,"1 oz",38,"1 pancake,  (4"" dia)"
"Pancakes, blueberry, prepared from recipe",29,,,28.35,"1 oz",38,"1 pancake,  (4"" dia)"
"Pancakes, buckwheat, dry mix, incomplete",71.3,8.5,7.21,28.35,"1 oz",122,"1 cup,  poured from box"
"Pancakes, special dietary, dry mix",73.9,,,28.35,"1 oz",227,"1 package,  (8 oz)"
"Pancakes, whole-wheat, dry mix, incomplete",71,,,28.35,"1 oz",140,"1 cup,  poured from box"
"Pancakes, whole-wheat, dry mix, incomplete, prepared",29.4,2.8,,28.35,"1 oz",44,"1 pancake,  (4"" dia)"
"Pie, apple, commercially prepared, enriched flour",34,1.6,15.65,28.35,"1 oz",125,"1 piece,  (1/8 of 9"" dia)"
"Pie, apple, prepared from recipe",37.1,,,28.35,"1 oz",155,"1 piece,  (1/8 of 9"" dia)"
"Pie, banana cream, prepared from mix, no-bake type",31.6,0.6,,28.35,"1 oz",92,"1 piece,  (1/8 of 9"" dia)"
"Pie, banana cream, prepared from recipe",32.9,0.7,12.06,28.35,"1 oz",1186,"1 pie,  (9"" dia)"
"Pie, blueberry, commercially prepared",34.9,1,9.89,28.35,"1 oz",125,"1 piece,  (1/8 of 9"" dia)"
"Pie, blueberry, prepared from recipe",33.5,,,28.35,"1 oz",147,"1 piece,  (1/8 of 9"" dia)"
"Pie, cherry, commercially prepared",39.8,0.8,14.29,28.35,"1 oz",125,"1 piece,  (1/8 of 9"" dia)"
"Pie, cherry, prepared from recipe",38.5,,,28.35,"1 oz",180,"1 piece,  (1/8 of 9"" dia)"
"Pie, chocolate creme, commercially prepared",33.6,2,,28.35,"1 oz",99,"1 piece,  (1/4 of 6"" pie)"
"Pie, chocolate mousse, prepared from mix, no-bake type",29.6,,,28.35,"1 oz",95,"1 piece,  (1/8 of 9"" dia)"
"Pie, coconut creme, commercially prepared",37.2,1.3,36.27,28.35,"1 oz",64,"1 piece,  (1/6 of 7"" pie)"
"Pie, coconut cream, prepared from mix, no-bake type",28.5,0.5,,28.35,"1 oz",94,"1 piece,  (1/8 of 9"" dia)"
"Pie, coconut custard, commercially prepared",30.2,1.8,,28.35,"1 oz",104,"1 piece,  (1/6 of 8"" pie)"
"Pie, egg custard, commercially prepared",20.8,1.6,11.58,28.35,"1 oz",105,"1 piece,  (1/6 of 8"" pie)"
"Pie, fried pies, fruit",42.6,2.6,21.4,28.35,"1 oz",128,"1 pie,  (5"" x 3-3/4"")"
"Pie, lemon meringue, commercially prepared",47.2,1.2,23.86,28.35,"1 oz",113,"1 piece,  (1/6 of 8"" pie)"
"Pie, lemon meringue, prepared from recipe",39.1,,,28.35,"1 oz",127,"1 piece,  (1/8 of 9"" dia)"
"Pie, mince, prepared from recipe",48,2.6,28.31,28.35,"1 oz",165,"1 piece,  (1/8 of 9"" dia)"
"Pie, peach",32.9,0.8,6.19,28.35,"1 oz",117,"1 piece,  (1/6 of 8"" pie)"
"Pie, pecan, commercially prepared",59.61,2.1,25.18,28.35,"1 oz",133,"1 slice"
"Pie, pecan, prepared from recipe",52.2,,,28.35,"1 oz",122,"1 piece,  (1/8 of 9"" dia)"
"Pie, pumpkin, commercially prepared",34.83,1.8,18.88,28.35,"1 oz",133,"1 slice"
"Pie, pumpkin, prepared from recipe",26.4,,,28.35,"1 oz",155,"1 piece,  (1/8 of 9"" dia)"
"Pie, vanilla cream, prepared from recipe",32.6,0.6,12.68,28.35,"1 oz",126,"1 piece,  (1/8 of 9"" dia)"
"Pie crust, cookie-type, prepared from recipe, graham cracker, baked",65.2,1.5,38.34,210,"1 pie shell,  (9"" dia)",22,"1 tart shell"
"Pie crust, standard-type, dry mix",52.1,,,28.35,"1 oz",284,"1 package,  (10 oz)"
"Pie crust, standard-type, dry mix, prepared, baked",50.4,1.8,,160,"1 crust,  single 9""",20,"1 piece,  (1/8 of 9"" crust)"
"Pie crust, standard-type, frozen, ready-to-bake, enriched",48.62,2.5,,173,"1 pie crust,  (average weight of 1 frozen crust)",,
"Pie crust, standard-type, frozen, ready-to-bake, enriched, baked",56.24,3.3,4.23,154,"1 pie crust,  (average weight of 1 baked crust)",,
"Pie crust, standard-type, prepared from recipe, baked",47.5,1.7,0.17,180,"1 crust,  single 9""",23,"1 piece,  (1/8 of 9"" crust)"
"Puff pastry, frozen, ready-to-bake",45.1,1.5,0.74,28.35,"1 oz",47,"1 shell"
"Phyllo dough",52.6,1.9,0.18,28.35,"1 oz",19,"1 sheet,  dough"
"Popovers, dry mix, enriched",71,,,28.35,"1 oz",170,"1 package,  (6 oz)"
"Rolls, dinner, plain, commercially prepared (includes brown-and-serve)",52.04,2,5.55,28,"1 roll,  (1 oz)",25,"1 each,  (pan, dinner, or small roll) (2"" square, 2"" high)"
"Rolls, dinner, egg",52,3.7,4.3,28.35,"1 oz",35,"1 roll,  (2-1/2"" dia)"
"Rolls, dinner, oat bran",40.2,4.1,6.67,28.35,"1 oz",33,"1 roll"
"Rolls, dinner, rye",53.1,4.9,1.17,43,"1 large,  (approx 3-1/2"" to 4"" dia)",36,"1 medium"
"Rolls, dinner, wheat",46,3.8,1.63,28,"1 roll,  (1 oz)",,
"Rolls, dinner, whole-wheat",51.1,7.5,8.46,28,"1 roll,  (1 oz)",43,"1 roll,  (hamburger, frankfurter roll)"
"Rolls, french",50.2,3.2,0.31,28.35,"1 oz",38,"1 roll"
"Rolls, hamburger or hotdog, plain",50.15,2.1,6.37,42,"1 roll",328,"1 package"
"Rolls, hamburger or hotdog, mixed-grain",44.6,3.8,6.25,28.35,"1 oz",43,"1 roll"
"Rolls, hamburger or hotdog, reduced-calorie",42.1,6.2,4.76,28.35,"1 oz",43,"1 roll"
"Rolls, hard (includes kaiser)",52.7,2.3,1.77,28.35,"1 oz",57,"1 roll,  (3-1/2"" dia)"
"Strudel, apple",41.1,2.2,25.75,28.35,"1 oz",71,"1 piece"
"Sweet rolls, cheese",43.7,1.2,,28.35,"1 oz",66,"1 roll"
"Sweet rolls, cinnamon, commercially prepared with raisins",50.9,2.4,31.73,28.35,"1 oz",83,"1 large"
"Sweet rolls, cinnamon, refrigerated dough with frosting",51.6,,,28.35,"1 oz",30,"1 roll"
"Sweet rolls, cinnamon, refrigerated dough with frosting, baked",56.1,,,28.35,"1 oz",30,"1 roll"
"Taco shells, baked",62.72,4.6,1.23,28.35,"1 oz",21,"1 large,  (6-1/2"" dia)"
"Toaster pastries, brown-sugar-cinnamon",68.1,1,,28.35,"1 oz",50,"1 toaster pastry"
"Toaster pastries, fruit (includes apple, blueberry, cherry, strawberry)",69.23,1.1,28.59,28.35,"1 oz",54,"1 toaster pastry"
"Tortillas, ready-to-bake or -fry, corn",44.64,6.3,0.88,28.35,"1 oz",19,"1 enchilada"
"Tortillas, ready-to-bake or -fry, flour, refrigerated",51.21,2.3,4.39,47,"1 tortilla",28.35,"1 oz"
"Waffles, plain, frozen, ready-to-heat",42.98,2.2,4.91,28.35,"1 oz",35,"1 waffle, square (4"" square) (include frozen)"
"Waffles, plain, prepared from recipe",32.9,,,28.35,"1 oz",75,"1 waffle, round (7"" dia)"
"Wonton wrappers (includes egg roll wrappers)",57.9,1.8,,28.35,"1 oz",32,"1 wrapper,  eggroll (7"" square)"
"Leavening agents, baking powder, double-acting, sodium aluminum sulfate",27.7,0.2,0,4.6,"1 tsp",2.3,".5 tsp"
"Leavening agents, baking powder, double-acting, straight phosphate",24.1,0.2,0,4.6,"1 tsp",2.3,".5 tsp"
"Leavening agents, baking powder, low-sodium",46.9,2.2,0,5,"1 tsp",2.5,".5 tsp"
"Leavening agents, baking soda",0,0,0,4.6,"1 tsp",2.3,".5 tsp"
"Leavening agents, cream of tartar",61.5,0.2,0,3,"1 tsp",1.5,".5 tsp"
"Leavening agents, yeast, baker's, compressed",18.1,8.1,0,17,"1 cake,  (0.6 oz)",,
"Leavening agents, yeast, baker's, active dry",41.22,26.9,0,4,"1 tsp",12,"1 tbsp"
"Bread crumbs, dry, grated, seasoned",68.49,4.9,5.74,28.35,"1 oz",120,"1 cup"
"Cookies, oatmeal, prepared from recipe, without raisins",66.4,,,28.35,"1 oz",15,"1 cookie,  (2-5/8"" dia)"
"Cookies, chocolate chip, prepared from recipe, made with butter",58.2,,,28.35,"1 oz",16,"1 cookie,  medium (2-1/4"" dia)"
"Bread, protein, toasted (includes gluten)",48.1,3.3,1.44,28.35,"1 oz",17,"1 slice"
"Bread, rice bran, toasted",47.3,5.3,5.08,28.35,"1 oz",25,"1 slice"
"Bread, wheat germ, toasted",54.3,2.3,4.14,28.35,"1 oz",25,"1 slice"
"Muffins, blueberry, toaster-type, toasted",56.7,1.9,12.95,28.35,"1 oz",31,"1 muffin,  toaster"
"Muffins, wheat bran, toaster-type with raisins, toasted",55.5,8.2,23.07,28.35,"1 oz",34,"1 muffin,  toaster"
"Pancakes, buttermilk, prepared from recipe",28.7,,,28.35,"1 oz",38,"1 pancake,  (4"" dia)"
"Rolls, dinner, plain, prepared from recipe, made with low fat (2%) milk",53.4,1.9,,28.35,"1 oz",43,"1 large,  roll or bun (3-1/2"" dia)"
"Pie crust, cookie-type, prepared from recipe, chocolate wafer, chilled",54.4,1.5,22.1,223,"1 crust,  single 9""",28,"1 piece,  (1/8 of 9"" crust)"
"Pie crust, cookie-type, prepared from recipe, graham cracker, chilled",63.9,1.5,37.57,244,"1 crust,  single 9""",30,"1 piece,  (1/8 of 9"" crust)"
"Crackers, matzo, egg and onion",77.1,5,,14.2,".5 oz",28,"1 matzo"
"Pie crust, cookie-type, prepared from recipe, vanilla wafer, chilled",50.2,0.1,7.33,129,"1 cup",176,"1 crust,  single 9"""
"Pie crust, standard-type, prepared from recipe, unbaked",42.3,3.4,0.15,194,"1 crust,  single 9""",24,"1 piece,  (1/8 of 9"" crust)"
"Waffles, plain, frozen, ready -to-heat, toasted",49.29,2.4,5.02,28.35,"1 oz",33,"1 waffle, round (4"" dia)"
"Bagels, plain, enriched, without calcium propionate (includes onion, poppy, sesame)",53.4,2.3,,28.35,"1 oz",26,"1 mini bagel,  (2-1/2"" dia)"
"Bagels, plain, unenriched, with calcium propionate (includes onion, poppy, sesame)",53.4,2.3,,28.35,"1 oz",26,"1 mini bagel,  (2-1/2"" dia)"
"Bagels, plain, unenriched, without calcium propionate(includes onion, poppy, sesame)",53.4,2.3,,28.35,"1 oz",26,"1 mini bagel,  (2-1/2"" dia)"
"Bread, cornbread, dry mix, unenriched (includes corn muffin mix)",69.5,6.5,,28.35,"1 oz",241,"1 package,  (8.5 oz)"
"Bread, pita, white, unenriched",55.7,2.2,,28.35,"1 oz",60,"1 pita,  large (6-1/2"" dia)"
"Bread, raisin, unenriched",52.3,4.3,,28.35,"1 oz",32,"1 slice,  large"
"Bread, white, commercially prepared, low sodium no salt",49.5,2.3,4.31,28.35,"1 oz",45,"1 cup, crumbs"
"Coffeecake, cinnamon with crumb topping, commercially prepared, unenriched",46.7,2,,28.35,"1 oz",57,"1 individual,  cake"
"Cake, pound, commercially prepared, other than all butter, unenriched",52.5,1,,30,"1 piece,  (1/10 of 10.6 oz cake)",28,"1 piece,  (1/12 of 12 oz cake)"
"Cake, white, dry mix, pudding-type, unenriched",81,0.7,,28.35,"1 oz",524,"1 package,  (18.50 oz)"
"Cake, yellow, dry mix, regular, unenriched",78.1,1.1,,28.35,"1 oz",524,"1 package,  (18.50 oz)"
"Cookies, butter, commercially prepared, unenriched",68.9,0.8,,28.35,"1 oz",5,"1 cookie"
"Cookies, chocolate chip, commercially prepared, regular, higher fat, unenriched",66.8,2.5,,28.35,"1 oz",10,"1 cookie,  medium (2-1/4"" dia)"
"Cookies, ladyfingers, without lemon juice and rind",59.7,1,,28.35,"1 oz",13,"1 anisette sponge,  (4"" x 1-1/8"" x 7/8"")"
"Crackers, melba toast, plain, without salt",76.6,6.3,,14.2,".5 oz",70,"1 cup, crushed"
"Crackers, saltines, low salt (includes oyster, soda, soup)",74.34,2.9,2.22,14.2,".5 oz",45,"1 cup,  oyster crackers"
"Crackers, saltines, unsalted tops (includes oyster, soda, soup)",71.5,3,,14.2,".5 oz",3,"1 cracker"
"Crackers, standard snack-type, regular, low salt",61,1.6,1.79,14.2,".5 oz",62,"1 cup, bite size"
"Crackers, wheat, low salt",64.9,4.5,13.04,14.2,".5 oz",83,"1 cup, crushed"
"Crackers, whole-wheat, low salt",68.6,10.5,0.37,14.2,".5 oz",94,"1 cup, crushed"
"Danish pastry, cinnamon, unenriched",44.6,1.2,,28.35,"1 oz",142,"1 large,  (approx 7"" dia)"
"Danish pastry, fruit, unenriched (includes apple, cinnamon, raisin, strawberry)",47.8,1.9,,28.35,"1 oz",142,"1 container,  (3 oz)"
"Bread, white, commercially prepared, toasted, low sodium no salt",54.4,,,28.35,"1 oz",23,"1 slice"
"Danish pastry, lemon, unenriched",47.8,1.9,,28.35,"1 oz",71,"1 pastry"
"Crackers, cheese, low sodium",58.2,2.4,0.28,14.2,".5 oz",62,"1 cup,  Cheez-its"
"Danish pastry, raspberry, unenriched",47.8,1.9,,28.35,"1 oz",71,"1 pastry,  (4-1/4"" dia)"
"Doughnuts, yeast-leavened, glazed, unenriched (includes honey buns)",44.3,1.2,,28.35,"1 oz",60,"1 doughnut,  medium (3-1/4"" dia)"
"English muffins, plain, enriched, without calcium propionate(includes sourdough)",46,2.7,,28.35,"1 oz",57,"1 muffin"
"English muffins, plain, unenriched, with calcium propionate (includes sourdough)",46,2.7,,28.35,"1 oz",57,"1 muffin"
"English muffins, plain, unenriched, without calcium propionate (includes sourdough)",46,2.7,,28.35,"1 oz",57,"1 muffin"
"Pie, apple, commercially prepared, unenriched flour",34,1.6,,28.35,"1 oz",125,"1 piece,  (1/8 of 9"" dia)"
"Pie, fried pies, cherry",42.6,2.6,,28.35,"1 oz",128,"1 pie,  (5"" x 3-3/4"")"
"Pie, fried pies, lemon",42.6,2.6,,28.35,"1 oz",128,"1 pie,  (5"" x 3-3/4"")"
"Pie crust, standard-type, frozen, ready-to-bake, unenriched",44.1,0.9,,142,"1 crust,  single 9""",16,"1 piece,  (1/8 of 9"" crust)"
"Popovers, dry mix, unenriched",71,,,28.35,"1 oz",170,"1 package,  (6 oz)"
"Taco shells, baked, without added salt",62.4,7.5,,28.35,"1 oz",13,"1 medium,  (approx 5"" dia)"
"Tortillas, ready-to-bake or -fry, corn, without added salt",46.6,5.2,,28.35,"1 oz",26,"1 tortilla,  medium (approx 6"" dia)"
"Tortillas, ready-to-bake or -fry, flour, without added calcium",55.6,3.3,,28.35,"1 oz",32,"1 tortilla,  medium (approx 6"" dia)"
"Cake, pound, commercially prepared, fat-free",61,1.1,34.34,28.35,"1 oz",340,"1 cake"
"Cake, snack cakes, cupcakes, chocolate, with frosting, low-fat",67.2,4.3,,28.35,"1 oz",43,"1 cupcake"
"Cake, yellow, dry mix, light",84.1,1.3,,28.35,"1 oz",524,"1 package,  (18.50 oz)"
"Cookies, oatmeal, commercially prepared, fat-free",78.6,7.3,41.9,28.35,"1 oz",,
"Crackers, saltines, fat-free, low-sodium",82.3,2.7,0.38,15,"3 saltines",30,"6 saltines"
"Breakfast tart, low fat",76.8,1.5,4.87,52,"1 tart",,
"Toaster Pastries, KELLOGG, KELLOGG'S POP TARTS, Apple cinnamon",72.02,1.1,33.7,52,"1 pastry",,
"Toaster Pastries, KELLOGG, KELLOGG'S POP TARTS, Blueberry",68.38,1.1,30.9,52,"1 pastry",,
"Toaster Pastries, KELLOGG, KELLOGG'S POP TARTS, Frosted blueberry",71.77,1.1,31.2,52,"1 pastry",,
"Toaster Pastries, KELLOGG, KELLOGG'S POP TARTS, Brown sugar cinnamon",64.4,1.5,25.4,50,"1 pastry",,
"Toaster Pastries, KELLOGG, KELLOGG'S POP TARTS, Frosted brown sugar cinnamon",68.32,1.3,30.8,50,"1 pastry",,
"Toaster Pastries, KELLOGG, KELLOGG'S POP TARTS, Cherry",71.19,1.1,31.7,52,"1 pastry",,
"Toaster Pastries, KELLOGG, KELLOGG'S POP TARTS, Frosted cherry",71.96,1,36,52,"1 pastry",,
"Toaster Pastries, KELLOGG, KELLOGG'S POP TARTS, Frosted chocolate fudge",71.8,1.1,38,52,"1 pastry",,
"Toaster Pastries, KELLOGG, KELLOGG'S POP TARTS, Frosted chocolate vanilla creme",70.84,1,37.3,52,"1 pastry",,
"Toaster Pastries, KELLOGG, KELLOGG'S POP TARTS, Frosted grape",72.25,1,35.4,52,"1 pastry",,
"Toaster Pastries, KELLOGG, KELLOGG'S POP TARTS, Frosted raspberry",71.54,1,35.4,52,"1 pastry",,
"Toaster Pastries, KELLOGG, KELLOGG'S POP TARTS, S'mores",69.6,1.4,36.5,52,"1 pastry",,
"Toaster Pastries, KELLOGG, KELLOGG'S POP TARTS, Strawberry",71,1.1,33,52,"1 pastry",,
"Toaster Pastries, KELLOGG, KELLOGG'S POP TARTS, Frosted strawberry",72.4,1,37.5,52,"1 pastry",,
"Toaster Pastries, KELLOGG, KELLOGG'S POP TARTS, Frosted wild berry",72.9,1,38.8,54,"1 pastry",,
"Toaster Pastries, KELLOGG, KELLOGG'S LOW FAT POP TARTS, Frosted brown sugar cinnamon",78.3,1.2,36.2,50,"1 pastry",,
"Toaster Pastries, KELLOGG, KELLOGG'S LOW FAT POP TARTS, Frosted chocolate fudge",76,1.1,36.2,52,"1 pastry",,
"Toaster Pastries, KELLOGG, KELLOGG'S LOW FAT POP TARTS, Strawberry",76.6,1.2,35.8,52,"1 pastry",,
"Toaster Pastries, KELLOGG, KELLOGG'S LOW FAT POP TARTS, Frosted strawberry",77.5,1.1,39.9,52,"1 pastry",,
"KELLOGG, KELLOGG'S EGGO, Buttermilk Pancake",38.1,1.1,8.2,116,"3 pancakes,  (NLEA serving)",,
"KELLOGG, KELLOGG'S EGGO, Banana Bread Waffles",41.6,2.5,6.7,78,"1 serving",,
"KELLOGG, KELLOG'S NUTRI-GRAIN CEREAL BARS, Mixed Berry",72.8,1.9,33.6,116,"1 bar,  (NLEA serving)",,
"KELLOGG'S Eggo Lowfat Homestyle Waffles",44.15,1,2.92,35,"1 round waffle, (4"" dia) (include frozen)",70,"1 serving"
"KELLOGG'S Eggo Lowfat Nutri-Grain Waffles",40.27,3.7,5.73,35,"1 waffle, round (4"" dia) (include frozen)",70,"1 serving"
"KELLOGG'S Eggo Lowfat Blueberry Nutri-Grain Waffles",42.71,3.5,8.89,35,"1 waffle, round (4"" dia) (include frozen)",70,"1 serving"
"KELLOGG'S Pop-Tarts Pastry Swirls, Apple Cinnamon Danish",59.7,1.4,17.7,62,"1 pastry",,
"KELLOGG'S Pop-Tarts Pastry Swirls, Strawberry Danish",60,1.8,25.8,62,"1 pastry",,
"KELLOGG'S Pop-Tarts Pastry Swirls, Cheese Danish",59.1,0.5,19.4,62,"1 pastry",,
"KELLOGG'S Eggo Golden Oat Waffles",37.52,3.5,3.47,35,"1 waffle, round (4"" dia) (include frozen)",70,"1 serving"
"ARCHWAY Home Style Cookies, Sugar Free Oatmeal",67.2,1.9,1.26,24,"1 serving",,
"ARCHWAY Home Style Cookies, Chocolate Chip Ice Box",65.02,2,34.06,24,"1 serving",,
"ARCHWAY Home Style Cookies, Coconut Macaroon",61.23,5.1,45.16,22,"1 serving",,
"ARCHWAY Home Style Cookies, Date Filled Oatmeal",68.16,2.1,34.27,25,"1 serving",,
"ARCHWAY Home Style Cookies, Dutch Cocoa",69.44,2.6,35.35,24,"1 serving",,
"ARCHWAY Home Style Cookies, Frosty Lemon",64.78,0.7,33.35,26,"1 serving",,
"ARCHWAY Home Style Cookies, Iced Molasses",69.12,1,38.43,28,"1 serving",,
"ARCHWAY Home Style Cookies, Iced Oatmeal",66.76,2,37.2,28,"1 serving",,
"ARCHWAY Home Style Cookies, Molasses",69.41,1.2,36.35,26,"1 serving",,
"ARCHWAY Home Style Cookies, Oatmeal",68.17,2.9,34.5,25,"1 serving",,
"ARCHWAY Home Style Cookies, Oatmeal Raisin",69.27,2.7,39.55,26,"1 serving",,
"ARCHWAY Home Style Cookies, Old Fashioned Molasses",70.55,1.1,36.09,26,"1 serving",,
"ARCHWAY Home Style Cookies, Old Fashioned Windmill Cookies",72.23,1.8,32.64,20,"1 serving",,
"ARCHWAY Home Style Cookies, Peanut Butter",58.48,2.8,32.55,21,"1 serving",,
"ARCHWAY Home Style Cookies, Raspberry Filled",65.92,2.2,31.76,25,"1 serving",,
"ARCHWAY Home Style Cookies, Strawberry Filled",65.92,2.2,31.76,25,"1 serving",,
"ARCHWAY Home Style Cookies, Reduced Fat Ginger Snaps",76.23,1.1,36.28,32,"1 serving",,
"Artificial Blueberry Muffin Mix, dry",77.45,,,31,"1 muffin",,
"KRAFT, STOVE TOP Stuffing Mix Chicken Flavor",73.1,2.5,10.1,28,"1 NLEA serving,  (makes 1/2 cup prepared)",,
"GEORGE WESTON BAKERIES, Brownberry Sage and Onion Stuffing Mix, dry",72.7,5.4,,67,"1 serving",,
"KEEBLER, KEEBLER Chocolate Graham SELECTS",71.8,,26.5,31,"1 serving",,
"KEEBLER, KEEBLER GOLDEN Vanilla Wafers, Artificially Flavored",69.7,,27.4,31,"1 serving",,
"CONTINENTAL MILLS, KRUSTEAZ Almond Poppyseed Muffin Mix, Artificially Flavored, dry",75.6,1.7,40,40,"1 serving",,
"MCKEE BAKING, LITTLE DEBBIE NUTTY BARS, Wafers with Peanut Butter, Chocolate Covered",55.2,,34,57,"1 serving",,
"MARTHA WHITE FOODS, Martha White's Chewy Fudge Brownie Mix, dry",83.58,2.9,54.76,28,"1 serving",,
"MARTHA WHITE FOODS, Martha White's Buttermilk Biscuit Mix, dry",59.41,1.5,4.46,41,"1 serving",,
"MISSION FOODS, MISSION Flour Tortillas, Soft Taco, 8 inch",49.6,,,51,"1 serving",,
"NABISCO, NABISCO GRAHAMS Crackers",76.2,3.4,23,28,"1 serving",,
"NABISCO, NABISCO OREO CRUNCHIES, Cookie Crumb Topping",70.23,3.2,36,11,"1 serving",,
"NABISCO, NABISCO RITZ Crackers",63.51,2.3,8.14,3.3,"1 cracker",16,"5 cracker,  (1 NLEA serving)"
"PILLSBURY, Buttermilk Biscuits, Artificial Flavor, refrigerated dough",45.31,1.6,6.25,64,"1 serving",,
