"Butter, salted",0.06,0,0.06,227,"1 cup",14.2,"1 tbsp"
"Butter, whipped, with salt",0.06,0,0.06,151,"1 cup",9.4,"1 tbsp"
"Butter oil, anhydrous",0,0,0,205,"1 cup",12.8,"1 tbsp"
"Cheese, blue",2.34,0,0.5,28.35,"1 oz",17,"1 cubic inch"
"Cheese, brick",2.79,0,0.51,132,"1 cup, diced",113,"1 cup, shredded"
"Cheese, brie",0.45,0,0.45,240,"1 cup, melted",144,"1 cup, sliced"
"Cheese, camembert",0.46,0,0.46,246,"1 cup",28.35,"1 oz"
"Cheese, caraway",3.06,0,,28.35,"1 oz",,
"Cheese, cheddar",1.28,0,0.52,132,"1 cup, diced",244,"1 cup, melted"
"Cheese, cheshire",4.78,0,,28.35,"1 oz",,
"Cheese, colby",2.57,0,0.52,132,"1 cup, diced",113,"1 cup, shredded"
"Cheese, cottage, creamed, large or small curd",3.38,0,2.67,113,"4 oz",210,"1 cup, large curd (not packed)"
"Cheese, cottage, creamed, with fruit",4.61,0.2,2.38,226,"1 cup,  (not packed)",113,"4 oz"
"Cheese, cottage, nonfat, uncreamed, dry, large or small curd",6.66,0,1.85,145,"1 cup,  (not packed)",113,"4 oz"
"Cheese, cottage, lowfat, 2% milkfat",3.66,0,3.67,226,"1 cup,  (not packed)",113,"4 oz"
"Cheese, cottage, lowfat, 1% milkfat",2.72,0,2.72,226,"1 cup,  (not packed)",113,"4 oz"
"Cheese, cream",4.07,0,3.21,232,"1 cup",14.5,"1 tbsp"
"Cheese, edam",1.43,0,1.43,28.35,"1 oz",198,"1 package,  (7 oz)"
"Cheese, feta",4.09,0,4.09,150,"1 cup, crumbled",28.35,"1 oz"
"Cheese, fontina",1.55,0,1.55,132,"1 cup, diced",108,"1 cup, shredded"
"Cheese, gjetost",42.65,0,,28.35,"1 oz",227,"1 package,  (8 oz)"
"Cheese, gouda",2.22,0,2.22,28.35,"1 oz",198,"1 package,  (7 oz)"
"Cheese, gruyere",0.36,0,0.36,132,"1 cup, diced",108,"1 cup, shredded"
"Cheese, limburger",0.49,0,0.49,134,"1 cup",28.35,"1 oz"
"Cheese, monterey",0.68,0,0.5,132,"1 cup, diced",113,"1 cup, shredded"
"Cheese, mozzarella, whole milk",2.19,0,1.03,112,"1 cup, shredded",28.35,"1 oz"
"Cheese, mozzarella, whole milk, low moisture",2.47,0,1.01,28.35,"1 oz",18,"1 cubic inch"
"Cheese, mozzarella, part skim milk",2.77,0,1.13,28.35,"1 oz",,
"Cheese, mozzarella, part skim milk, low moisture",3.83,0,0.6,132,"1 cup, diced",113,"1 cup, shredded"
"Cheese, muenster",1.12,0,1.12,132,"1 cup, diced",113,"1 cup, shredded"
"Cheese, neufchatel",3.59,0,3.19,28.35,"1 oz",85,"1 package,  (3 oz)"
"Cheese, parmesan, grated",4.06,0,0.9,100,"1 cup",5,"1 tbsp"
"Cheese, parmesan, hard",3.22,0,0.8,28.35,"1 oz",10.3,"1 cubic inch"
"Cheese, port de salut",0.57,0,0.57,132,"1 cup, diced",113,"1 cup, shredded"
"Cheese, provolone",2.14,0,0.56,132,"1 cup, diced",28.35,"1 oz"
"Cheese, ricotta, whole milk",3.04,0,0.27,246,"1 cup",124,".5 cup"
"Cheese, ricotta, part skim milk",5.14,0,0.31,246,"1 cup",28.35,"1 oz"
"Cheese, romano",3.63,0,0.73,28.35,"1 oz",142,"5 package,  (5 oz)"
"Cheese, roquefort",2,0,,28.35,"1 oz",85,"1 package,  (3 oz)"
"Cheese, swiss",5.38,0,1.32,132,"1 cup, diced",244,"1 cup, melted"
"Cheese, tilsit",1.88,0,,28.35,"1 oz",170,"1 package,  (6 oz)"
"Cheese, pasteurized process, American, fortified with vitamin D",3.7,0,2.26,140,"1 cup, diced",244,"1 cup, melted"
"Cheese, pasteurized process, pimento",1.73,0.1,0.62,140,"1 cup, diced",244,"1 cup, melted"
"Cheese, pasteurized process, swiss",2.1,0,1.23,140,"1 cup, diced",113,"1 cup, shredded"
"Cheese food, cold pack, american",8.32,0,,28.35,"1 oz",227,"1 package,  (8 oz)"
"Cheese food, pasteurized process, American, vitamin D fortified",8.56,0,5.59,113,"1 cup",28.35,"1 oz"
"Cheese food, pasteurized process, swiss",4.5,0,,28.35,"1 oz",227,"1 package,  (8 oz)"
"Cheese spread, pasteurized process, American",8.73,0,7.32,32,"2 tablespoon",28.35,"1 oz"
"Cream, fluid, half and half",4.3,0,0.16,242,"1 cup",15,"1 tbsp"
"Cream, fluid, light (coffee cream or table cream)",3.66,0,0.14,240,"1 cup",15,"1 tbsp"
"Cream, fluid, light whipping",2.96,0,0.11,120,"1 cup,  whipped",239,"1 cup, fluid (yields 2 cups whipped)"
"Cream, fluid, heavy whipping",2.79,0,0.11,120,"1 cup,  whipped",238,"1 cup, fluid (yields 2 cups whipped)"
"Cream, whipped, cream topping, pressurized",12.49,0,8,60,"1 cup",3,"1 tbsp"
"Cream, sour, reduced fat, cultured",4.26,0,0.16,242,"1 cup",15,"1 tbsp"
"Cream, sour, cultured",2.88,0,2.88,230,"1 cup",12,"1 tbsp"
"Eggnog",8.05,0,8.05,254,"1 cup",31.8,"1 fl oz"
"Sour dressing, non-butterfat, cultured, filled cream-type",4.68,0,4.68,235,"1 cup",12,"1 tbsp"
"Milk, filled, fluid, with blend of hydrogenated vegetable oils",4.74,0,,244,"1 cup",976,"1 quart"
"Milk, filled, fluid, with lauric acid oil",4.74,0,4.74,244,"1 cup",30.5,"1 fl oz"
"Cream substitute, liquid, with hydrogenated vegetable oil and soy protein",11.38,0,11.38,240,"1 cup",30,"1 fl oz"
"Cream substitute, liquid, with lauric acid oil and sodium caseinate",11.38,0,,15,"1 container,  individual",120,".5 cup"
"Cream substitute, powdered",54.88,0,54.88,94,"1 cup",2,"1 tsp"
"Dessert topping, powdered",52.54,0,52.54,43,"1.5 oz",1.3,"1 portion,  amount to make 1 tbsp"
"Dessert topping, powdered, 1.5 ounce prepared with 1/2 cup milk",17.13,0,17.13,80,"1 cup",4,"1 tbsp"
"Dessert topping, pressurized",16.07,0,16.07,70,"1 cup",4,"1 tbsp"
"Dessert topping, semi solid, frozen",23.05,0,23.05,75,"1 cup",4,"1 tbsp"
"Sour cream, imitation, cultured",6.63,0,6.63,230,"1 cup",28.35,"1 oz"
"Milk substitutes, fluid, with lauric acid oil",6.16,0,,244,"1 cup",976,"1 quart"
"Milk, whole, 3.25% milkfat, with added vitamin D",4.8,0,5.05,244,"1 cup",15,"1 tbsp"
"Milk, producer, fluid, 3.7% milkfat",4.65,0,,244,"1 cup",976,"1 quart"
"Milk, reduced fat, fluid, 2% milkfat, with added vitamin A and vitamin D",4.8,0,5.06,244,"1 cup",30.5,"1 fl oz"
"Milk, reduced fat, fluid, 2% milkfat, with added nonfat milk solids and vitamin A and vitamin D",4.97,0,,245,"1 cup",980,"1 quart"
"Milk, reduced fat, fluid, 2% milkfat, protein fortified, with added vitamin A and vitamin D",5.49,0,5.26,246,"1 cup",984,"1 quart"
"Milk, lowfat, fluid, 1% milkfat, with added vitamin A and vitamin D",4.99,0,5.2,244,"1 cup",30.5,"1 fl oz"
"Milk, lowfat, fluid, 1% milkfat, with added nonfat milk solids, vitamin A and vitamin D",4.97,0,,245,"1 cup",980,"1 quart"
"Milk, lowfat, fluid, 1% milkfat, protein fortified, with added vitamin A and vitamin D",5.52,0,,246,"1 cup",984,"1 quart"
"Milk, nonfat, fluid, with added vitamin A and vitamin D (fat free or skim)",4.96,0,5.09,245,"1 cup",30.6,"1 fl oz"
"Milk, nonfat, fluid, with added nonfat milk solids, vitamin A and vitamin D (fat free or skim)",5.02,0,5.02,245,"1 cup",30.6,"1 fl oz"
"Milk, nonfat, fluid, protein fortified, with added vitamin A and vitamin D (fat free and skim)",5.56,0,,246,"1 cup",984,"1 quart"
"Milk, buttermilk, fluid, cultured, lowfat",4.79,0,4.79,245,"1 cup",30.6,"1 fl oz"
"Milk, low sodium, fluid",4.46,0,4.46,244,"1 cup",30.5,"1 fl oz"
"Milk, dry, whole, with added vitamin D",38.42,0,38.42,128,"1 cup",32,".25 cup"
"Milk, dry, nonfat, regular, without added vitamin A and vitamin D",51.98,0,51.98,120,"1 cup",30,".25 cup"
"Milk, dry, nonfat, instant, with added vitamin A and vitamin D",52.19,0,52.19,68,"1 cup",91,"1 envelope,  (1-1/3 cup)"
"Milk, dry, nonfat, calcium reduced",51.8,0,,28.35,"1 oz",113,".25 lb"
"Milk, buttermilk, dried",49,0,49,120,"1 cup",6.5,"1 tbsp"
"Milk, canned, condensed, sweetened",54.4,0,54.4,306,"1 cup",38.2,"1 fl oz"
"Milk, canned, evaporated, with added vitamin D and without added vitamin A",10.04,0,10.04,252,"1 cup",31.5,"1 fl oz"
"Milk, canned, evaporated, nonfat, with added vitamin A and vitamin D",11.35,0,11.35,256,"1 cup",31.9,"1 fl oz"
"Milk, chocolate, fluid, commercial, whole, with added vitamin A and vitamin D",10.34,0.8,9.54,250,"1 cup",31.2,"1 fl oz"
"Milk, chocolate, fluid, commercial, reduced fat, with added vitamin A and vitamin D",12.13,0.7,9.55,250,"1 cup",31.2,"1 fl oz"
"Milk, chocolate, fluid, commercial, lowfat, with added vitamin A and vitamin D",10.44,0.5,9.94,250,"1 cup",1000,"1 quart"
"Milk, chocolate beverage, hot cocoa, homemade",10.74,1,9.66,250,"1 cup",31.2,"1 fl oz"
"Milk, goat, fluid, with added vitamin D",4.45,0,4.45,244,"1 cup",30.5,"1 fl oz"
"Milk, human, mature, fluid",6.89,0,6.89,246,"1 cup",30.8,"1 fl oz"
"Milk, indian buffalo, fluid",5.18,0,,244,"1 cup",976,"1 quart"
"Milk, sheep, fluid",5.36,0,,245,"1 cup",980,"1 quart"
"Milk shakes, thick chocolate",21.15,0.3,20.85,28.4,"1 fl oz",300,"1 container,  (10.6 oz)"
"Milk shakes, thick vanilla",17.75,0,17.75,28.4,"1 fl oz",313,"1 container,  (11 oz)"
"Whey, acid, fluid",5.12,0,5.12,246,"1 cup",984,"1 quart"
"Whey, acid, dried",73.45,0,73.45,57,"1 cup",2.9,"1 tbsp"
"Whey, sweet, fluid",5.14,0,5.14,246,"1 cup",984,"1 quart"
"Whey, sweet, dried",74.46,0,74.46,145,"1 cup",7.5,"1 tbsp"
"Yogurt, plain, whole milk, 8 grams protein per 8 ounce",4.66,0,4.66,245,"1 cup,  (8 fl oz)",227,"1 container,  (8 oz)"
"Yogurt, plain, low fat, 12 grams protein per 8 ounce",7.04,0,7.04,245,"1 cup,  (8 fl oz)",227,"1 container,  (8 oz)"
"Yogurt, plain, skim milk, 13 grams protein per 8 ounce",7.68,0,7.68,245,"1 cup,  (8 fl oz)",227,"1 container,  (8 oz)"
"Yogurt, vanilla, low fat, 11 grams protein per 8 ounce",13.8,0,13.8,245,"1 cup,  (8 fl oz)",227,"1 container,  (8 oz)"
"Yogurt, fruit, low fat, 9 grams protein per 8 ounce",18.64,0,18.64,245,"1 cup,  (8 fl oz)",125,"1 container,  (4.4 oz)"
"Yogurt, fruit, low fat, 10 grams protein per 8 ounce",19.05,0,19.05,245,"1 cup,  (8 fl oz)",170,"1 container,  (6 oz)"
"Yogurt, fruit, low fat, 11 grams protein per 8 ounce",18.6,0,,227,"1 container,  (8 oz)",113,".5 container,  (4 oz)"
"Egg, whole, raw, fresh",0.72,0,0.37,243,"1 cup,  (4.86 large eggs)",56,"1 extra large"
"Egg, white, raw, fresh",0.73,0,0.71,243,"1 cup",33,"1 large"
"Egg, yolk, raw, fresh",3.59,0,0.56,243,"1 cup",17,"1 large"
"Egg, yolk, raw, frozen",1.15,0,0.51,227,".5 lb",,
"Egg, yolk, raw, frozen, sugared",10.8,0,,227,".5 lb",,
"Egg, whole, cooked, fried",0.83,0,0.4,46,"1 large",,
"Egg, whole, cooked, hard-boiled",1.12,0,1.12,136,"1 cup, chopped",8.5,"1 tbsp"
"Egg, whole, cooked, omelet",0.64,0,0.31,15,"1 tbsp",61,"1 large"
"Egg, whole, cooked, poached",0.71,0,0.37,50,"1 large",,
"Egg, whole, cooked, scrambled",1.61,0,1.39,220,"1 cup",13.7,"1 tbsp"
"Egg, whole, dried",4.95,0,3.08,85,"1 cup,  sifted",5,"1 tbsp"
"Egg, whole, dried, stabilized, glucose reduced",2.38,0,,85,"1 cup,  sifted",5,"1 tbsp"
"Egg, white, dried, flakes, glucose reduced",4.17,0,4.17,227,".5 lb",,
"Egg, white, dried, powder, glucose reduced",4.47,0,4.47,107,"1 cup,  sifted",7,"1 tbsp"
"Egg, yolk, dried",3.6,0,3.6,67,"1 cup,  sifted",4,"1 tbsp"
"Egg, duck, whole, fresh, raw",1.45,0,0.93,70,"1 egg",,
"Egg, goose, whole, fresh, raw",1.35,0,0.94,144,"1 egg",,
"Egg, quail, whole, fresh, raw",0.41,0,0.4,9,"1 egg",,
"Egg, turkey, whole, fresh, raw",1.15,0,,79,"1 egg",,
"Egg substitute, powder",21.8,0,21.8,9.9,".35 oz",20,".7 oz"
"Butter, without salt",0.06,0,0.06,227,"1 cup",14.2,"1 tbsp"
"Cheese, parmesan, shredded",3.41,0,0.9,5,"1 tbsp",,
"Milk, nonfat, fluid, without added vitamin A and vitamin D (fat free or skim)",4.96,0,5.09,245,"1 cup",980,"1 quart"
"Milk, reduced fat, fluid, 2% milkfat, with added nonfat milk solids, without added vitamin A",5.49,0,,245,"1 cup",980,"1 quart"
"Milk, canned, evaporated, with added vitamin A",10.04,0,,31.5,"1 fl oz",126,".5 cup"
"Milk, dry, nonfat, regular, with added vitamin A and vitamin D",51.98,0,51.98,120,"1 cup",30,".25 cup"
"Milk, dry, nonfat, instant, without added vitamin A and vitamin D",52.19,0,52.19,68,"1 cup",91,"1 envelope,  (1-1/3 cup)"
"Cheese, goat, hard type",2.17,0,2.17,28.35,"1 oz",,
"Cheese, goat, semisoft type",2.54,0,2.54,28.35,"1 oz",,
"Cheese, goat, soft type",0.89,0,0.89,28.35,"1 oz",,
"Egg, yolk, raw, frozen, salted",1.6,0,,227,".5 lb",,
"Cheese substitute, mozzarella",23.67,0,23.67,113,"1 cup, shredded",28.35,"1 oz"
"Cheese fondue",3.77,0,,215,"1 cup",108,".5 cup"
"Cheese sauce, prepared from recipe",5.48,0.1,0.19,243,"1 cup",30,"2 tbsp"
"Cheese, mexican, queso anejo",4.63,0,4.63,132,"1 cup, crumbled",28.35,"1 oz"
"Cheese, mexican, queso asadero",2.87,0,2.87,132,"1 cup, diced",113,"1 cup, shredded"
"Cheese, mexican, queso chihuahua",5.56,0,5.56,132,"1 cup, diced",113,"1 cup, shredded"
"Cheese, low fat, cheddar or colby",1.91,0,0.52,132,"1 cup, diced",113,"1 cup, shredded"
"Cheese, low-sodium, cheddar or colby",1.91,0,0.49,132,"1 cup, diced",113,"1 cup, shredded"
"Egg, whole, raw, frozen",1.05,0,,,,,
"Egg, white, raw, frozen",1.05,0,,,,,
"Egg, white, dried",7.8,0,5.4,,,,
"Milk, reduced fat, fluid, 2% milkfat, without added vitamin A and vitamin D",4.8,0,5.06,,,,
"Milk, fluid, 1% fat, without added vitamin A and vitamin D",4.99,0,5.2,,,,
"Sour cream, reduced fat",7,0,0.3,12,"1 tablespoon",230,"1 cup"
"Sour cream, light",7.1,0,0.22,12,"1 tablespoon",230,"1 cup"
"Sour cream, fat free",15.6,0,0.39,12,"1 tablespoon",230,"1 cup"
"USDA Commodity, cheese, cheddar, reduced fat",2,0,0.58,113,"1 cup, shredded",,
"Yogurt, vanilla or lemon flavor, nonfat milk, sweetened with low-calorie sweetener",7.5,0,7.5,170,"1 container,  (6 oz)",,
"Parmesan cheese topping, fat free",40,0,1.5,5,"1 tablespoon",,
"Cheese, cream, fat free",7.66,0,5.48,18,"1 tbsp",,
"Yogurt, chocolate, nonfat milk",23.53,1.2,14.97,170,"1 container,  (6 oz)",,
"KRAFT CHEEZ WHIZ Pasteurized Process Cheese Sauce",9.2,0.3,6.7,33,"2 tbsp",,
"KRAFT CHEEZ WHIZ LIGHT Pasteurized Process Cheese Product",16.2,0.2,8.2,35,"2 tbsp",,
"KRAFT FREE Singles American Nonfat Pasteurized Process Cheese Product",11.7,0.2,6.7,21,"1 slice",,
"KRAFT VELVEETA Pasteurized Process Cheese Spread",9.8,0,8.1,28,"1 oz",,
"KRAFT VELVEETA LIGHT Reduced Fat Pasteurized Process Cheese Product",11.8,0,8.5,28,"1 oz",,
"KRAFT BREAKSTONE'S Reduced Fat Sour Cream",6.5,0.1,6.4,31,"2 tbsp",,
"KRAFT BREAKSTONE'S FREE Fat Free Sour Cream",15.1,0,7.2,32,"2 tbsp",,
"KRAFT BREYERS Lowfat Strawberry Yogurt (1% Milkfat)",18.2,0.2,17.4,227,"1 container,  (8 oz)",,
"KRAFT BREYERS LIGHT N' LIVELY Lowfat Strawberry Yogurt (1% Milkfat)",21.9,0.2,19.6,125,"1 container,  (4.4 oz)",,
"KRAFT BREYERS Smooth & Creamy Lowfat Strawberry Yogurt (1% Milkfat)",19.9,0.3,17.2,227,"1 container,  (8 oz)",,
"KRAFT BREYERS LIGHT Nonfat Strawberry Yogurt (with Aspartame and Fructose Sweeteners)",9.9,0,7.7,227,"1 container,  (8 oz)",,
"Cream, half and half, fat free",9,0,5,29,"2 tbsp",484,"1 pint"
"Reddi Wip Fat Free Whipped Topping",25,0.4,16,4,"1 tablespoon",75,"1 cup"
"Milk, chocolate, fluid, commercial, reduced fat, with added calcium",12.13,0.7,9.55,250,"1 cup",31.2,"1 fl oz"
"Yogurt, fruit, lowfat, with low calorie sweetener",18.6,0,2.9,227,"1 8 oz container,  (8 oz)",245,"1 cup,  (8 fl oz)"
"Cheese, parmesan, dry grated, reduced fat",1.37,0,0,100,"1 cup",5,"1 tbsp"
"Cream substitute, flavored, liquid",35.07,1.1,33.04,15,"1 tbsp",,
"Cream substitute, flavored, powdered",75.42,1.2,58.01,12,"4 tsp",,
"Cheese, provolone, reduced fat",3.5,0,0.55,132,"1 cup, diced",113,"1 cup, shredded"
"Cheese, Mexican, blend, reduced fat",3.41,0,0.56,28.35,"1 oz",28,".25 cup"
"Egg Mix, USDA Commodity",23.97,,2.46,8.6,"1 tbsp",105,"1 cup"
"Milk, whole, 3.25% milkfat, without added vitamin A and vitamin D",4.78,0,5.05,244,"1 cup",15,"1 tbsp"
"Milk, dry, whole, without added vitamin D",38.42,0,38.42,128,"1 cup",32,".25 cup"
"Milk, canned, evaporated, without added vitamin A and vitamin D",10.04,0,10.04,252,"1 cup",31.5,"1 fl oz"
"Cheese product, pasteurized process, American, reduced fat, fortified with vitamin D",10.6,0,8.02,21,"1 slice,  3/4 oz",19,"1 slice,  2/3 oz"
"Yogurt, fruit, low fat, 9 grams protein per 8 ounce, fortified with vitamin D",18.64,0,18.64,245,"1 cup,  (8 fl oz)",125,"1 container,  (4.4 oz)"
"Yogurt, fruit, low fat, 10 grams protein per 8 ounce, fortified with vitamin D",19.05,0,19.05,245,"1 cup,  (8 fl oz)",170,"1 container,  (6 oz)"
"Yogurt, fruit variety, nonfat, fortified with vitamin D",19,0,19,245,"1 cup,  (8 fl oz)",125,"1 container,  (4.4 oz)"
"Yogurt, fruit, lowfat, with low calorie sweetener, fortified with vitamin D",18.6,0,2.9,227,"1 8 oz container,  (8 oz)",245,"1 cup,  (8 fl oz)"
"Yogurt, vanilla, low fat, 11 grams protein per 8 ounce, fortified with vitamin D",13.8,0,13.8,245,"1 cup,  (8 fl oz)",227,"1 container,  (8 oz)"
"Yogurt, vanilla or lemon flavor, nonfat milk, sweetened with low-calorie sweetener, fortified with vitamin D",7.5,0,7.5,170,"1 container,  (6 oz)",,
"Yogurt, chocolate, nonfat milk, fortified with vitamin D",23.53,1.2,14.97,170,"1 container,  (6 oz)",,
"Protein supplement, milk based, Muscle Milk, powder",18.5,7.1,5.71,11,"1 tbsp",,
"Protein supplement, milk based, Muscle Milk Light, powder",22,2,4,50,"2 scoop",,
"Dulce de Leche",55.35,0,49.74,19,"1 tbsp",,
"Egg substitute, liquid or frozen, fat free",2,0,2,240,"1 cup",60,".25 cup"
"Cheese, dry white, queso seco",2.04,,0.55,97,"1 cup, grated",,
"Cheese, fresh, queso fresco",2.98,0,2.32,122,"1 cup, crumbled",,
"Cheese, white, queso blanco",2.53,,1.76,118,"1 cup, crumbled",,
"Milk, buttermilk, fluid, whole",4.88,0,4.88,245,"1 cup",,
"Yogurt, vanilla flavor, lowfat milk, sweetened with low calorie sweetener",13.8,0,5.43,170,"1 container",,
"Yogurt, frozen, flavors not chocolate, nonfat milk, with low-calorie sweetener",19.7,2,12.61,68,".5 cup",,
"Ice cream, soft serve, chocolate",22.2,0.7,21.16,86,".5 cup",,
"Ice cream, bar or stick, chocolate covered",24.5,0.8,18.3,50,"1 bar",,
"Ice cream sandwich",37.14,0,18.57,,,,
"Ice cream cookie sandwich",39.6,1.2,21.3,82,"1 serving",,
"Ice cream cone, chocolate covered, with nuts, flavors other than chocolate",34.38,1,25,96,"1 unit",,
"Ice cream sandwich, made with light ice cream, vanilla",39.64,0,17.86,70,"1 serving",,
"Ice cream sandwich, vanilla, light, no sugar added",42.86,7.1,6.58,70,"1 serving",,
"Fat free ice cream, no sugar added, flavors other than chocolate",27.94,7.4,8.82,68,".5 cup",,
"Milk dessert bar, frozen, made from lowfat milk",33.09,6.6,22.06,68,"1 bar",,
"Nutritional supplement for people with diabetes, liquid",11.88,2.2,2.64,227,"1 can",,
"Cheese, Mexican blend",1.75,0,1.23,28,".25 cup, shredded",,
"Cheese product, pasteurized process, American, vitamin D fortified",8.52,0,6.57,,,,
"Cheese, pasteurized process, American, without added vitamin D",3.7,0,2.26,140,"1 cup, diced",244,"1 cup, melted"
"Cheese food, pasteurized process, American, without added vitamin D",8.56,0,5.59,113,"1 cup",28.35,"1 oz"
"Egg, whole, raw, frozen, salted",0.83,0,0.07,,,,
"Spices, allspice, ground",72.12,21.6,,6,"1 tbsp",1.9,"1 tsp"
"Spices, anise seed",50.02,14.6,,6.7,"1 tbsp, whole",2.1,"1 tsp, whole"
"Spices, basil, dried",47.75,37.7,1.71,0.7,"1 tsp, leaves",2.1,"1 tbsp, leaves"
"Spices, bay leaf",74.97,26.3,,1.8,"1 tbsp, crumbled",0.6,"1 tsp, crumbled"
"Spices, caraway seed",49.9,38,0.64,6.7,"1 tbsp",2.1,"1 tsp"
"Spices, cardamom",68.47,28,,5.8,"1 tbsp, ground",2,"1 tsp, ground"
"Spices, celery seed",41.35,11.8,0.67,6.5,"1 tbsp",2,"1 tsp"
"Spices, chervil, dried",49.1,11.3,,1.9,"1 tbsp",0.6,"1 tsp"
"Spices, chili powder",49.7,34.8,7.19,8,"1 tbsp",2.7,"1 tsp"
"Spices, cinnamon, ground",80.59,53.1,2.17,7.9,"1 tbsp",2.6,"1 tsp"
"Spices, cloves, ground",65.53,33.9,2.38,6.5,"1 tbsp",2.1,"1 tsp"
"Spices, coriander leaf, dried",52.1,10.4,7.27,1.8,"1 tbsp",0.6,"1 tsp"
"Spices, coriander seed",54.99,41.9,,5,"1 tbsp",1.8,"1 tsp"
"Spices, cumin seed",44.24,10.5,2.25,6,"1 tbsp, whole",2.1,"1 tsp, whole"
"Spices, curry powder",58.15,33.2,2.76,6.3,"1 tbsp",2,"1 tsp"
"Spices, dill seed",55.17,21.1,,6.6,"1 tbsp",2.1,"1 tsp"
"Spices, dill weed, dried",55.82,13.6,,3.1,"1 tbsp",1,"1 tsp"
"Spices, fennel seed",52.29,39.8,,5.8,"1 tbsp, whole",2,"1 tsp, whole"
"Spices, fenugreek seed",58.35,24.6,,11.1,"1 tbsp",3.7,"1 tsp"
"Spices, garlic powder",72.73,9,2.43,9.7,"1 tbsp",3.1,"1 tsp"
"Spices, ginger, ground",71.62,14.1,3.39,5.2,"1 tbsp",1.8,"1 tsp"
"Spices, mace, ground",50.5,20.2,,5.3,"1 tbsp",1.7,"1 tsp"
"Spices, marjoram, dried",60.56,40.3,4.09,1.7,"1 tbsp",0.6,"1 tsp"
"Spices, mustard seed, ground",28.09,12.2,6.79,6.3,"1 tbsp",2,"1 tsp"
"Spices, nutmeg, ground",49.29,20.8,28.49,7,"1 tbsp",2.2,"1 tsp"
"Spices, onion powder",79.12,15.2,6.63,6.9,"1 tbsp",2.4,"1 tsp"
"Spices, oregano, dried",68.92,42.5,4.09,1,"1 tsp, leaves",1.8,"1 tsp, ground"
"Spices, paprika",53.99,34.9,10.34,6.8,"1 tbsp",2.3,"1 tsp"
"Spices, parsley, dried",50.64,26.7,7.27,0.5,"1 tsp",1.6,"1 tbsp"
"Spices, pepper, black",63.95,25.3,0.64,6.9,"1 tbsp, ground",2.3,"1 tsp, ground"
"Spices, pepper, red or cayenne",56.63,27.2,10.34,5.3,"1 tbsp",1.8,"1 tsp"
"Spices, pepper, white",68.61,26.2,,7.1,"1 tbsp, ground",2.4,"1 tsp, ground"
"Spices, poppy seed",28.13,19.5,2.99,8.8,"1 tbsp",2.8,"1 tsp"
"Spices, poultry seasoning",65.59,11.3,3.08,4.4,"1 tbsp",1.5,"1 tsp"
"Spices, pumpkin pie spice",69.28,14.8,7.76,5.6,"1 tbsp",1.7,"1 tsp"
"Spices, rosemary, dried",64.06,42.6,,3.3,"1 tbsp",1.2,"1 tsp"
"Spices, saffron",65.37,3.9,,2.1,"1 tbsp",0.7,"1 tsp"
"Spices, sage, ground",60.73,40.3,1.71,2,"1 tbsp",0.7,"1 tsp"
"Spices, savory, ground",68.73,45.7,,4.4,"1 tbsp",1.4,"1 tsp"
"Spices, tarragon, dried",50.22,7.4,,0.6,"1 tsp, leaves",1.8,"1 tbsp, leaves"
"Spices, thyme, dried",63.94,37,1.71,1,"1 tsp, leaves",2.7,"1 tbsp, leaves"
"Spices, turmeric, ground",64.93,21.1,3.21,6.8,"1 tbsp",2.2,"1 tsp"
"Basil, fresh",2.65,1.6,0.3,5.3,"2 tbsp, chopped",2.5,"5 leaves"
"Dill weed, fresh",7.02,2.1,,8.9,"1 cup, sprigs",1,"5 sprigs"
"Mustard, prepared, yellow",5.33,3.3,0.86,5,"1 tsp,  or 1 packet",249,"1 cup"
"Salt, table",0,0,0,292,"1 cup",18,"1 tbsp"
"Vinegar, cider",0.93,0,0.4,239,"1 cup",14.9,"1 tbsp"
"Thyme, fresh",24.45,14,,0.8,"1 tsp",0.4,".5 tsp"
"Vanilla extract",12.65,0,12.65,208,"1 cup",13,"1 tbsp"
"Vanilla extract, imitation, alcohol",2.41,0,,13,"1 tbsp",4.2,"1 tsp"
"Vanilla extract, imitation, no alcohol",14.4,0,14.4,13,"1 tbsp",4.2,"1 tsp"
"Vinegar, distilled",0.04,0,0.04,238,"1 cup",14.9,"1 tbsp"
"Capers, canned",4.89,3.2,0.41,8.6,"1 tbsp,  drained",,
"Horseradish, prepared",11.29,3.3,7.99,15,"1 tbsp",5,"1 tsp"
"Rosemary, fresh",20.7,14.1,,1.7,"1 tbsp",0.7,"1 tsp"
"Peppermint, fresh",14.89,8,,3.2,"2 tbsp",0.1,"2 leaves"
"Spearmint, fresh",8.41,6.8,,11.4,"2 tbsp",0.3,"2 leaves"
"Spearmint, dried",52.04,29.8,,1.6,"1 tbsp",0.5,"1 tsp"
"Vinegar, red wine",0.27,0,0,239,"1 cup",14.9,"1 tbsp"
"Vinegar, balsamic",17.03,,14.95,255,"1 cup",16,"1 tbsp"
"CAMPBELL Soup Company, PACE, Dry Taco Seasoning Mix",56.29,18.8,18.76,5.3,"2 tbsp,  (1 serving)",,
"Babyfood, juice treats, fruit medley, toddler",86.68,0,57.4,28,"1 packet",,
"Babyfood, meat, beef, strained",2.43,0,0,14.7,"1 tbsp",28.35,"1 oz"
"Babyfood, meat, beef, junior",2.43,0,0,28.35,"1 oz",14.7,"1 tbsp"
"Babyfood, meat, veal, strained",1.51,0,0,16,"1 tbsp",28.35,"1 oz"
"Babyfood, meat, pork, strained",0,0,0,28.35,"1 oz",71,"1 jar"
"Babyfood, meat, ham, strained",3.7,0,0,15,"1 tbsp",28.35,"1 oz"
"Babyfood, meat, ham, junior",3.7,0,0,28.35,"1 oz",71,"1 jar"
"Babyfood, meat, lamb, strained",0.85,0,0,22,"1 tbsp",28.35,"1 oz"
"Babyfood, meat, lamb, junior",0,0,0,28.35,"1 oz",71,"1 jar"
"Babyfood, meat, chicken, strained",0.1,0,0,15,"1 tbsp",28.35,"1 oz"
"Babyfood, meat, chicken, junior",0,0,0,15,"1 tbsp",28.35,"1 oz"
"Babyfood, meat, chicken sticks, junior",1.5,0.2,1.4,10,"1 stick",71,"1 jar"
"Babyfood, meat, turkey, strained",1.4,0,0,15,"1 tbsp",28.35,"1 oz"
"Babyfood, meat, turkey, junior",1.4,0,0,19,"1 tbsp",68,"1 container"
"Babyfood, meat, turkey sticks, junior",1.4,0.5,1.4,10,"1 stick",71,"1 jar"
"Gerber graduates Fruit Strips Real Fruit Bars",76.61,7.8,68.65,9.9,"1 bar",,
"Babyfood, meat, meat sticks, junior",1.1,0.2,0.8,10,"1 stick",71,"1 jar"
"Babyfood, dinner, vegetables and dumplings and beef, strained",7.7,,0,28.35,"1 oz",113,"1 jar"
"Babyfood, dinner, vegetables and dumplings and beef, junior",8,,0,28.35,"1 oz",170,"1 jar"
"Babyfood, dinner, beef lasagna, toddler",10,,0,28.35,"1 oz",170,"1 jar"
"Babyfood, dinner, macaroni and tomato and beef, strained",9.45,1.2,2.09,16,"1 tbsp",28.35,"1 oz"
"Babyfood, dinner, macaroni and tomato and beef, junior",9.4,1.1,2.43,16,"1 tbsp",28.35,"1 oz"
"Babyfood, ravioli, cheese filled, with tomato sauce",16.3,0.1,0.59,16,"1 tbsp",8,"1 piece"
"Babyfood, dinner, beef noodle, strained",8.18,1.3,1.42,16,"1 tbsp",28.35,"1 oz"
"Babyfood, macaroni and cheese, toddler",11.2,0.5,0.79,113,"1 container",,
"Babyfood, dinner, beef and rice, toddler",8.8,,0,28.35,"1 oz",170,"1 jar"
"Babyfood, dinner, spaghetti and tomato and meat, junior",11.42,1.1,2.72,16,"1 tbsp",28.35,"1 oz"
"Babyfood, dinner, spaghetti and tomato and meat, toddler",10.8,,,28.35,"1 oz",170,"1 jar"
"Babyfood, dinner, beef stew, toddler",5.5,1.1,1.39,28.35,"1 oz",170,"1 jar"
"Babyfood, dinner, vegetables and beef, strained",8.84,1.3,2.34,256,"1 cup",16,"1 tbsp"
"Babyfood, dinner, vegetables and beef, junior",8.84,1.3,2.34,256,"1 cup",16,"1 tbsp"
"Babyfood, dinner, beef with vegetables",6.36,1.8,2.16,113,"1 jar,  Beech-Nut Stage 2 (4 oz)",,
"Babyfood, dinner, vegetables and bacon, strained",8.81,1.7,1.77,256,"1 cup",16,"1 tbsp"
"Babyfood, dinner, vegetables and ham, strained",7.8,1.6,1.37,256,"1 cup",16,"1 tbsp"
"Babyfood, dinner, vegetables and ham, junior",8.64,1,0.99,256,"1 cup",16,"1 tbsp"
"Babyfood, dinner, vegetables and lamb, strained",6.9,1.1,0.94,256,"1 cup",16,"1 tbsp"
"Babyfood, dinner, vegetables and lamb, junior",7.1,1.1,0.94,28.35,"1 oz",170,"1 jar"
"Babyfood, dinner, chicken noodle, strained",9.08,2.1,2.5,16,"1 tbsp",28.35,"1 oz"
"Babyfood, dinner, chicken noodle, junior",8.79,0.9,1.07,16,"1 tbsp",28.35,"1 oz"
"Babyfood, dinner, chicken soup, strained",7.2,1.1,1.72,,,16,"1 tbsp"
"Babyfood, dinner, chicken stew, toddler",6.4,0.6,1.68,16,"1 tbsp",28.35,"1 oz"
"Babyfood, dinner, vegetables chicken, strained",8.42,2.1,1.58,256,"1 cup",16,"1 tbsp"
"Babyfood, dinner, vegetables, noodles and chicken, strained",7.9,1.1,,28.35,"1 oz",113,"1 jar"
"Babyfood, dinner, vegetables, noodles and chicken, junior",9.1,1.1,,28.35,"1 oz",170,"1 jar"
"Babyfood, dinner, pasta with vegetables",8.4,1.5,1.2,113,"1 jar,  Gerber (4 oz)",,
"Babyfood, dinner, vegetables and noodles and turkey, strained",6.8,1.1,,28.35,"1 oz",113,"1 jar"
"Babyfood, dinner, vegetables and noodles and turkey, junior",7.6,1.1,,28.35,"1 oz",170,"1 jar"
