"Cereals ready-to-eat, KASHI HEART TO HEART, Honey Toasted Oat",76.4,13.4,17.7,33,".75 cup,  (1 NLEA serving)",,
"Cereals ready-to-eat, KASHI 7 Whole Grain Puffs",79.4,8,3.2,19,"1 cup,  (1 NLEA serving)",,
"Cereals ready-to-eat, KASHI 7 Whole Grain Honey Puffs",79,6,21.8,30,"1 cup,  (1 NLEA serving)",,
"Cereals ready-to-eat, KASHI Good Friends",79.3,21.7,18.8,53,"1 cup,  (1 NLEA serving)",,
"Cereals ready-to-eat, KASHI GOLEAN",58,19.6,12,52,"1 cup,  (1 NLEA serving)",,
"Cereals ready-to-eat, QUAKER, MOTHER'S HONEY ROUNDUP",87.77,3.1,35.68,,,,
"Cereals ready-to-eat, QUAKER, Honey Nut Oats",84.53,4.3,38.64,,,,
"Cereals ready-to-eat, Cranberry Macadamia Nut Cereal",76.98,6,28.73,60,"1 cup",,
"Cereals, QUAKER, Quick Oats, Dry",68.18,9.4,1.42,40,".5 cup",,
"Cereals ready-to-eat, MALT-O-MEAL, Frosted Flakes",90.9,1.9,37.4,30,".75 cup,  (1 NLEA serving)",40,"1 cup"
"Cereals, QUAKER, Instant Oatmeal, Cinnamon-Spice, dry",73.49,7.7,20.06,43,"1 packet",,
"Cereals, QUAKER, Instant Oatmeal, DINOSAUR EGGS with ""DINOSAUR BONES"", Brown Sugar Cinnamon, dry",75.85,5.6,39,50,"1 packet",,
"Cereals, QUAKER, Instant Oatmeal EXPRESS, Golden Brown Sugar, dry",77.01,6.1,32.45,55,"1 container",,
"Cereals, QUAKER, Instant Oatmeal, Banana Bread, dry",75.86,6.4,30.47,41,"1 packet",,
"Cereals, QUAKER, Instant Oatmeal EXPRESS, Baked Apple, dry",77.43,7.3,34.58,54,"1 container",,
"Cereals, QUAKER, Instant Oatmeal EXPRESS Cinnamon Roll, Dry",76.34,6.9,30.91,54,"1 container",,
"Cereals ready-to-eat, UNCLE SAM CEREAL",65.78,20.3,1.56,55,"1 cup,  (1 serving)",,
"Cereals, QUAKER, Instant Oatmeal, Raisin and Spice, dry",75.31,6.4,33.5,43,"1 packet",,
"Cereals, QUAKER, Instant Grits Product with Redeye Gravy and Imitation Ham Bits, Dry",76.62,4.6,,28,"1 packet",,
"Cereals, QUAKER, Instant Grits Product with Imitation Bacon Bits and Cheddar Flavor, Dry",72.49,4.7,2.27,28,"1 packet",,
"Cereals, QUAKER, Instant Grits Product with American Cheese Flavor, Dry",75.15,4.4,2.01,28,"1 packet",,
"Cereals, QUAKER, Instant Grits Product--Ham 'n' Cheese",71.98,4.2,,28,"1 packet",,
"Cereals, QUAKER, Quick Oats with Iron, Dry",68.18,9.4,1.42,40,".5 cup",,
"Cereals, QUAKER, Whole Wheat Natural Cereal",74.8,9.9,2,40,".5 cup",,
"Cereals ready-to-eat, KELLOGG'S, FRUIT HARVEST Strawberry/Blueberry",87,4.6,34,29,".75 cup,  (1 NLEA serving)",,
"Cereals ready-to-eat, KELLOGG'S, FROSTED MINI-WHEATS, Maple & Brown Sugar, Bite Size",82,9.6,24,52,"24 biscuit,  (1 NLEA serving)",,
"Cereals ready-to-eat, KASHI, GOOD FRIENDS, Cinna-Raisin Crunch",80.3,16.6,25.6,50,"1 cup,  (1 NLEA serving)",,
"Cereals ready-to-eat, KASHI, ORGANIC PROMISE Autumn Wheat",79,11.2,12.4,54,"29 biscuits,  (1 NLEA serving)",,
"Cereals ready-to-eat, KASHI ORGANIC PROMISE, STRAWBERRY FIELDS",87.1,3.5,29.3,32,"1 cup,  (1 NLEA serving)",,
"Cereals ready-to-eat, KELLOGG'S, Reduced Sugar Frosted Flakes Cereal",89,0.9,24.2,31,"1 cup,  (1 NLEA serving)",,
"Cereals ready-to-eat, KELLOGG'S, SPECIAL K Protein Plus",47.8,17,6.7,29,".75 cup,  (1 NLEA serving)",,
"Cereals ready-to-eat, MALT-O-MEAL, Honey BUZZERS",87.6,2.9,37.4,29,"1.333 cup",,
"Cereals ready-to-eat, MALT-O-MEAL, GOLDEN PUFFS",89.72,2.6,51.34,27,".75 cup,  (1 NLEA serving)",37,"1 cup"
"Cereals ready-to-eat, Malt-O-Meal Honey Graham Squares",80.33,3.3,33.33,30,".75 cup,  (1 NLEA serving)",,
"Cereals ready-to-eat, MALT-O-MEAL, Puffed Wheat Cereal",78.8,7.3,1.1,15,"1 cup",,
"Cereals ready-to-eat, MALT-O-MEAL, Raisin Bran Cereal",76.9,13.5,30.3,59,"1 cup",,
"Cereals ready-to-eat, MALT-O-MEAL, Blueberry Muffin Tops Cereal",80,4.8,35.4,30,".75 cup",,
"Cereals, MALT-O-MEAL, Farina Hot Wheat Cereal, dry",74.3,3.9,0.7,35,"3 tbsp",,
"Cereals ready-to-eat, MALT-O-MEAL, Maple & Brown Sugar Hot Wheat Cereal, dry",84.5,3.1,35.6,45,".25 cup",,
"Cereals ready-to-eat, MALT-O-MEAL, Honey Nut TOASTY O'S Cereal",81.53,5.6,38.73,30,"1 cup",,
"Cereals ready-to-eat, MALT-O-MEAL, Puffed Rice Cereal",90.2,1,0.8,15,"1 cup",,
"Cereals ready-to-eat, MALT-O-MEAL, Apple ZINGS",87.3,2.8,42.9,33,"1 cup",,
"Cereals ready-to-eat, MALT-O-MEAL, CINNAMON TOASTERS",79.1,4.7,34.8,30,".75 cup",,
"Cereals ready-to-eat, MALT-O-MEAL, Cocoa DYNO-BITES",89.4,1.2,45.2,29,".75 cup",,
"Cereals ready-to-eat, MALT-O-MEAL, Frosted Mini SPOONERS",82.9,10.5,17.9,55,"1 cup",,
"Cereals ready-to-eat, MALT-O-MEAL, Fruity DYNO-BITES",90.1,1,42.6,27,".75 cup",,
"Cereals ready-to-eat, NATURE'S PATH, OPTIMUM",73.37,18.2,29.09,55,"1 cup",,
"Cereals ready-to-eat, NATURE'S PATH, OPTIMUM SLIM",69.09,20,18.18,55,"1 cup",,
"Cereals ready-to-eat, Ralston Enriched Bran flakes",79.77,16.9,17.17,29,"1 serving,  (NLEA serving size = 0.75 cup)",42,"1 cup"
"Cereals ready-to-eat, Ralston Corn Biscuits",85.79,2.6,9.51,30,"1 serving,  (NLEA serving size = 1 cup)",31,"1 cup"
"Cereals ready-to-eat, Ralston Corn Flakes",88.01,2.7,7.84,28,"1 serving,  (NLEA serving size = 1 cup)",31,"1 cup"
"Cereals ready-to-eat, Ralston Crispy Hexagons",86.78,1.5,9.57,29,"1 serving,  (NLEA serving size = 1 cup)",28,"1 cup"
"Cereals ready-to-eat, USDA Commodity Corn and Rice (includes all commodity brands)",86.85,1.4,10.35,29,"1 cup",29,"1 serving,  (NLEA serving = 1 cup)"
"Cereals ready-to-eat, USDA Commodity Rice Crisps (includes all commodity brands)",86.04,0.7,8.35,33,"1.25 serving,  (NLEA serving = 1.25 cup)",28,"1 cup"
"Milk and cereal bar",72.05,0.4,45.97,,,,
"Cereals, Malt-o-Meal, plain, prepared with water, without salt",8.72,0.5,0.13,268,"1 serving,  (3 T dry cereal plus 1 cup water)",,
"Cereals, Malt-O-Meal, chocolate, prepared with water, without salt",9.22,0.5,2.81,268,"1 serving,  (3 T dry cereal plus 1 cup water)",,
"Cereals ready-to-eat, GENERAL MILLS, CHOCOLATE LUCKY CHARMS",82.14,3.6,35.71,28,".75 cup,  (1 NLEA serving)",,
"Cereals ready-to-eat, GENERAL MILLS, Frosted CHEX",89.26,0,33.33,30,".75 cup,  (1 NLEA serving)",,
"Cereals ready-to-eat, KELLOGG, Berry RICE KRISPIES",88,0.3,31,30,"1 cup,  (1 NLEA serving)",,
"Cereals ready-to-eat, KELLOGG, KELLOGG'S Cinnamon MINI SWIRLZ",83,3.4,11,30,"1 cup,  (1 NLEA serving)",,
"Cereals ready-to-eat, KELLOGG, EGGO cereal, maple syrup",80,5.9,37,31,"1 cup,  (1 NLEA serving)",,
"Cereals ready-to-eat, KELLOGG, SMART START Strong Heart, Toasted Oat",79,8.9,28,60,"1.25 cup,  (1 NLEA serving)",,
"Cereals ready-to-eat, KELLOGG, SMORZ",83,2.5,43,30,"1 cup,  (1 NLEA serving)",,
"Cereals ready-to-eat, KELLOGG, SPECIAL K, Fruit & Yogurt",85.4,6.5,32.8,32,".75 cup,  (1 NLEA serving)",,
"Cereals ready-to-eat, KASHI 7 Whole Grain Flakes",81.8,11.3,8.6,50,"1 cup,  (1 NLEA serving)",,
"Cereals ready-to-eat, KASHI, HEART TO HEART, Wild Blueberry",79.8,8.1,22.3,55,"1 cup,  (1 NLEA serving)",,
"Cereals ready-to-eat, KASHI ORGANIC PROMISE, CINNAMON HARVEST",79,10.7,16.5,55,"28 biscuits,  (1 NLEA serving)",,
"Cereals ready-to-eat, KELLOGG'S, FROSTED MINI-WHEATS Bite Size Strawberry Delight",82.7,9.6,23.5,52,"24 biscuits,  (1 NLEA serving)",,
"Cereals ready-to-eat, KELLOGG'S, SPECIAL K Vanilla Almond",83.1,6.9,30.4,30,".75 cup,  (1 NLEA serving)",,
"Cereals ready-to-eat, POST Selects Cranberry Almond Crunch",78.9,7.2,26.2,51,".75 cup,  (1 NLEA serving)",,
"Cereals ready-to-eat, QUAKER, Toasted Oatmeal Supreme Cereal, Strawberry Mango",80.72,6.4,26.61,55,"1 cup,  (1 NLEA serving)",,
"Rice and Wheat cereal bar",72.73,1.8,31.8,22,"1 bar",,
"Cereals ready-to-eat, QUAKER, QUAKER Toasted Oatmeal Cereal",80.39,5.6,23.76,49,"1 cup,  (1 NLEA serving)",,
"Cereals ready-to-eat, QUAKER, QUAKER Honey Graham LIFE Cereal",78.56,6.3,23.12,32,".75 cup,  (1 NLEA serving)",,
"Cereals ready-to-eat, QUAKER, Christmas Crunch",85.92,2.6,44.31,26,"1 serving,  (1 NLEA serving)",,
"Cereals ready-to-eat, GENERAL MILLS, CHEERIOS, Yogurt Burst, strawberry",81.75,6.7,30,30,".75 cup,  (1 NLEA serving)",,
"Cereals ready-to-eat, rolled oats, whole wheat, rice, presweetened, maple flavored, with pecans",76.9,6,24.5,52,"1 serving,  (1 NLEA serving)",,
"Cereal wafer straws, KELLOGG, FROOT LOOPS Cereal straws",78.4,3.1,38.6,31,"3 straws,  (1 NLEA serving)",,
"Cereals ready-to-eat, KASHI GO LEAN CRUNCH!, Honey Almond Flax",67,16.2,23,53,"1 cup,  (1 NLEA serving)",,
"Cereals, KASHI GO LEAN Hot Cereal, Hearty Honey & Cinnamon, dry",63,19.4,15,40,"1 packet,  (1 NLEA serving)",,
"Cereals, KASHI GO LEAN Hot Cereal, Creamy TRULY VANILLA, dry",65,12.8,18,40,"1 packet,  (1 NLEA serving)",,
"Cereals ready-to-eat, KASHI Granola, COCOA BEACH cereal",66.3,13.2,20,55,".5 cup,  (1 NLEA serving)",,
"Cereals ready-to-eat, KASHI Granola, Summer Berry cereal",70.9,13.2,16.8,55,".5 cup,  (1 NLEA serving)",,
"Cereals ready-to-eat, KASHI Granola, MOUNTAIN MEDLEY cereal",69.2,12.1,21.2,55,".5 cup,  (1 NLEA serving)",,
"Cereals ready-to-eat, KASHI 7 Whole Grain Nuggets",81,11.7,5,58,".5 cup,  (1 NLEA serving)",,
"Cereals, KASHI HEART TO HEART, Instant Oatmeal, Apple Cinnamon, dry",78,11.4,28,43,"1 packet,  (1 NLEA serving)",,
"Cereals, KASHI HEART TO HEART, Instant Oatmeal, golden brown maple, dry",77,11.6,27,43,"1 packet,  (1 NLEA serving)",,
"Cereals, Cream of Wheat, 2 1/2 minute cook time, dry",71.79,4.4,0.47,33,"3 tablespoon,  (1 NLEA serving)",13.8,"1 tbsp"
"Cereals, Cream of Wheat, 2 1/2 minute cook time, cooked with water, stove-top, without salt",11.74,0.7,0.07,244,"1 cup",,
"Cereals, Cream of Wheat, 2 1/2 minute cook time, cooked with water, microwaved, without salt",10.1,0.7,0.34,231,"1 cup",,
"Cereals, CREAM OF WHEAT, 1 minute cook time, dry",72.63,4.4,0.51,33,"3 tablespoon,  (1 serving)",13.7,"1 tbsp"
"Cereals, CREAM OF WHEAT, 1 minute cook time, cooked with water, stove-top, without salt",11.16,0.4,0.07,245,"1 cup",,
"Cereals, CREAM OF WHEAT, 1 minute cook time, cooked with water, microwaved, without salt",10.67,1.5,2.98,237,"1 cup",,
"Cereals ready-to-eat, GENERAL MILLS, 25% Less Sugar Cinnamon Toast Cereal",78.57,10.7,21.43,28,"1 bowl,  (1 NLEA serving)",,
"Incaparina, dry mix (corn and soy flours), unprepared",60.53,9.9,,8.9,"1 tbsp",128,"1 cup"
"Cereals ready-to-eat, GENERAL MILLS, Curves Fruit & Nut Crunch cereal",85.44,10.2,20.41,,,,
"Cereals ready-to-eat, GENERAL MILLS, DORA THE EXPLORER",83,10.2,21.2,27,".75 cup,  (1 NLEA serving)",,
"Cereals ready-to-eat, GENERAL MILLS, Fruity CHEERIOS",85.19,7.4,33.33,27,".75 cup,  (1 NLEA serving)",,
"Cereals ready-to-eat, KELLOGG'S SPECIAL K Chocolatey Delight",81,7.2,29.9,31,".75 cup,  (1 NLEA serving)",,
"Cereals ready-to-eat, GENERAL MILLS, TOTAL, Cranberry Crunch",78,6.9,27.59,58,"1.25 cup,  (1 NLEA serving)",,
"Cereals ready-to-eat, GENERAL MILLS, 25% Less Sugar TRIX",85.49,4.8,28.57,21,".75 cup",,
"Cereals ready-to-eat, KELLOGG, KELLOGG'S SPECIAL K Low Fat Granola",75.1,11.7,17.5,52,".5 cup,  (1 NLEA serving)",,
"Cereals, ready-to-eat, KELLOGG, KELLOGG'S CINNABON cereal",83.3,3.9,41.6,30,"1 cup,  (1 NLEA serving)",,
"Cereals ready-to-eat, KASHI GOLEAN CRISP Toasted Berry Crumble",68.7,17.4,20.2,51,".75 cup,  (1 NLEA serving)",,
"Cereals ready-to-eat, KASHI HEART TO HEART, Warm Cinnamon",75.8,14.2,14.3,33,".75 cup,  (1 NLEA serving)",,
"Cereals ready-to-eat, KASHI ORGANIC PROMISE, ISLAND VANILLA",80.8,10.7,16.9,55,"27 biscuits,  (1 NLEA serving)",,
"Cereals ready-to-eat, GENERAL MILLS, CHEERIOS, Banana Nut",84.7,6.1,33.4,28,".75 cup,  (1 NLEA serving)",,
"Cereals ready-to-eat, GENERAL MILLS, CHEERIOS, Chocolate",83.4,6.4,34.5,27,".75 cup,  (1 NLEA serving)",,
"Cereals ready-to-eat, GENERAL MILLS, Chocolate CHEX",80.4,3,26.4,32,".75 cup,  (1 NLEA serving)",,
"Cereals ready-to-eat, GENERAL MILLS Cinnamon CHEX",82.4,3.3,26.1,30,".75 cup,  (1 NLEA serving)",,
"Cereals ready-to-eat, GENERAL MILLS, FIBER ONE, Caramel Delight",82.8,19.2,20.8,50,"1 cup,  (1 NLEA serving)",,
"Cereals ready-to-eat, GENERAL MILLS, FIBER ONE, Frosted Shredded Wheat",81.7,15,20.3,60,"1 cup,  (1 NLEA serving)",,
"Cereals ready-to-eat, GENERAL MILLS, FIBER ONE, Honey Clusters",85.2,26.7,11.7,52,"1 cup,  (1 NLEA serving)",,
"Cereals ready-to-eat, GENERAL MILLS, FIBER ONE, Raisin Bran Clusters",85.3,21.3,24.8,55,"1 cup,  (1 NLEA serving)",,
"Cereals ready-to-eat, GENERAL MILLS, TOTAL, Blueberry Pomegranate",76.8,8,21.9,49,"1 cup,  (1 NLEA serving)",,
"Cereals ready-to-eat, GENERAL MILLS, WHEATIES, Fuel",82.8,9.7,24.9,55,".75 cup,  (1 NLEA serving)",,
"Cereals ready-to-eat, KELLOGG, KELLOGG'S SPECIAL K, Cinnamon Pecan",81.3,8.2,24.2,30,".75 cup,  (1 NLEA serving)",,
"Cereals ready-to-eat, KELLOGG, KELLOGG'S SPECIAL K Blueberry",86.5,9.6,27.5,30,".75 cup,  (1 NLEA serving)",,
"Cereals ready-to-eat, KELLOGG, KELLOGG'S ALL-BRAN Strawberry Medley",79.8,18,19,55,"1 cup,  (1 NLEA serving)",,
"Cereals ready-to-eat, KASHI, KASHI U",76,12,18,55,"1 cup,  (1 NLEA serving)",,
"Cereals ready-to-eat, BEAR NAKED Banana Nut",78.1,11.4,21.7,57,".75 cup,  (1 NLEA serving)",,
"Cereals ready-to-eat, BEAR NAKED Cranberry Raisin",78.4,8,26.8,56,".67 cup,  (1 NLEA serving)",,
"Cereals ready-to-eat, KASHI Berry Blossom",84.9,18.8,23.5,30,".75 cup,  (1 NLEA serving)",,
"Cereals ready-to-eat, KASHI Golden Goodness",82.5,9.5,14.8,60,"1.25 cup,  (1 NLEA serving)",,
"Cereals ready-to-eat, KASHI Honey Sunshine",84.2,17.4,18,30,".75 cup,  (1 NLEA serving)",,
"Cereals ready-to-eat, KELLOGG's FIBERPLUS Cinnamon Oat Crunch",81.9,28.2,21.5,32,".75 cup,  (1 NLEA serving)",,
"Cereals ready-to-eat, KELLOGG's FIBERPLUS Berry Yogurt Crunch",80.9,18.9,23.5,53,"1 cup,  (1 NLEA serving)",,
"Cereals ready-to-eat, KELLOGG'S SPECIAL K Multigrain Oats and Honey",85,8.6,26.4,29,".666 cup,  (1 NLEA serving)",,
"Cereals ready-to-eat, KELLOGG's CRUNCHY NUT Roasted Nut and Honey O's",84.1,7,36.9,27,".75 cup,  (1 NLEA serving)",,
"Cereals ready-to-eat, KELLOGG'S CRUNCHY NUT Golden Honey Nut flakes",82.3,1.5,35.7,31,".75 cup,  (1 NLEA serving)",,
"Cereals ready-to-eat, KELLOGG's FROSTED MINI-WHEATS Bite Size Cinnamon Streusel",82,8.2,24,52,"24 biscuits,  (1 NLEA serving)",,
"Cereals ready-to-eat, KELLOGG's FROSTED MINI-WHEATS Bite Size Blueberry Muffin",83.5,10,23,52,"24 biscuits,  (1 NLEA serving)",,
"Cereals ready-to-eat, KELLOGG'S Pops MiXit cereal, all flavors",86.68,8.6,38.78,30,"1 cup,  (1 NLEA serving)",,
"Cereals ready-to-eat, KELLOGG'S CORN FLAKES, Simply Cinnamon",85,1.3,19.7,32,"1 cup,  (1 NLEA serving)",,
"Cereals ready-to-eat, KELLOGG's RAISIN BRAN Extra!",77.4,12.4,24,49,"1 cup,  (1 NLEA serving)",,
"Cereals ready-to-eat, KELLOGG's FROSTED MINI-WHEATS Touch of Fruit in the Middle Mixed Berry",82.1,10.6,17.7,55,"21 biscuits,  (1 NLEA serving)",,
"Cereals ready-to-eat, QUAKER, Simple Harvest All Natural Multigrain Cereal, Banana, Honey and Pecan",78.81,7.7,26.92,50,"1 cup,  (1 NLEA serving)",,
"Cereals ready-to-eat, QUAKER, Simple Harvest All Natural Multigrain Cereal, Cinnamon and Honey",79.96,7.5,25.74,52,"1 cup,  (1 NLEA serving)",,
" Cereals ready-to-eat, QUAKER, CAP'N CRUNCH'S Homerun Crunch Cereal",85.9,2.6,44.2,26,".75 cup,  (1 NLEA serving)",,
" Cereals ready-to-eat, QUAKER, CAP'N CRUNCH'S Halloween Crunch",85.14,2.5,43.82,26,".75 cup,  (1 NLEA serving)",,
" Cereals ready-to-eat, QUAKER, CAP'N CRUNCH'S Touchdown Cereal",85.9,2.6,44.2,26,".75 cup,  (1 NLEA serving)",,
"QUAKER, Natural Granola Apple Cranberry Almond",74.73,9.9,27.43,49,".5 cup,  (1 NLEA serving)",,
"Cereals ready-to-eat, QUAKER, Maple Brown Sugar LIFE Cereal",78.86,6.3,24.9,32,".75 cup,  (1 NLEA serving)",,
"QUAKER, Cap'n Crunch's OOPS! All Berries Cereal",87.1,2.6,44.18,32,"1 cup,  (1 NLEA serving)",,
"Cereals ready-to-eat, KELLOGG'S FROSTED FLAKES with fiber, less sugar",87.6,7.8,27.4,30,".75 cup,  (1 NLEA serving)",,
"Cereals ready-to-eat, KELLOGG'S FROSTED MINI-WHEATS Little Bites, chocolate",81.9,10.9,22.6,55,"52 biscuits,  (1 NLEA serving)",,
"Cereals ready-to-eat, QUAKER Squares, Golden Maple",78.02,8.3,16.78,56,"1 cup,  (1 NLEA serving)",,
"Cereals ready-to-eat, Post Honey Bunches of Oats with vanilla bunches",81.7,7.1,21.43,56,"1 cup,  (1 NLEA serving)",,
"Cereals ready-to-eat, GENERAL MILLS, Cocoa Puffs, 25% Reduced Sugar",83.3,5.8,26.1,24,".75 cup,  (1 NLEA serving)",,
"Cereals ready-to-eat, GENERAL MILLS, Sprinkles Cookie Crisp",86.1,4.5,37.7,27,".75 cup,  (1 NLEA serving)",,
"Cereals ready-to-eat, GENERAL MILLS, Oat Cluster CHEERIOS Crunch",80.6,7.2,28.9,27,".75 cup,  (1 NLEA serving)",,
"Cereals, QUAKER, Instant Oatmeal, Women for Self, assorted flavors",71.13,9.2,23.31,40,"1 packet",,
"Cereals, QUAKER, Instant Oatmeal, Cinnamon Spice, reduced sugar",69.69,8.7,11.91,34,"1 packet",,
"Cereals, QUAKER, Instant Oatmeal Organic, Regular",67,9.8,1,41,"1 packet",,
"Cereals, QUAKER, Instant Oatmeal, fruit and cream, variety of flavors, reduced sugar",71.57,8.3,17.66,33,"1 packet",,
"Cereals, QUAKER, Instant Oatmeal, Apple and Cinnamon, reduced sugar",74.12,9.3,19.34,29,"1 packet",,
"Cereals ready-to-eat, GENERAL MILLS, Honey KIX",85.2,8.7,18.9,33,"1.25 cup,  (1 NLEA serving)",,
"Cereals ready-to-eat, GENERAL MILLS, COCOA PUFFS Combos, chocolate and vanilla",84.6,4.1,37.9,27,".75 cup,  (1 NLEA serving)",,
"Acerola, (west indian cherry), raw",7.69,1.1,,98,"1 cup",4.8,"1 fruit, without refuse"
"Acerola juice, raw",4.8,0.3,4.5,242,"1 cup",30.2,"1 fl oz"
"Apples, raw, with skin",13.81,2.4,10.39,125,"1 cup, quartered or chopped",109,"1 cup, slices"
"Apples, raw, without skin",12.76,1.3,10.1,110,"1 cup, slices",216,"1 large,  (3-1/4"" dia)"
"Apples, raw, without skin, cooked, boiled",13.64,2.4,11.01,171,"1 cup, slices",,
"Apples, raw, without skin, cooked, microwave",14.41,2.8,11.61,170,"1 cup, slices",,
"Apples, canned, sweetened, sliced, drained, unheated",16.7,1.7,15,204,"1 cup, slices",,
"Apples, canned, sweetened, sliced, drained, heated",16.84,2,14.84,204,"1 cup, slices",,
"Apples, dehydrated (low moisture), sulfured, uncooked",93.53,12.4,81.13,60,"1 cup",,
"Apples, dehydrated (low moisture), sulfured, stewed",19.91,2.6,,193,"1 cup",,
"Apples, dried, sulfured, uncooked",65.89,8.7,57.19,86,"1 cup",6.4,"1 ring"
"Apples, dried, sulfured, stewed, without added sugar",15.32,2,13.32,255,"1 cup",,
"Apples, dried, sulfured, stewed, with added sugar",20.73,1.9,,280,"1 cup",,
"Apples, frozen, unsweetened, unheated",12.31,1.3,,173,"1 cup, slices",,
"Apples, frozen, unsweetened, heated",12,1.3,,206,"1 cup, slices",,
"Apple juice, canned or bottled, unsweetened, without added ascorbic acid",11.3,0.2,9.62,248,"1 cup",31,"1 fl oz"
"Apple juice, frozen concentrate, unsweetened, undiluted, without added ascorbic acid",41,0.4,38.83,211,"1 can,  (6 fl oz)",,
"Apple juice, frozen concentrate, unsweetened, diluted with 3 volume water without added ascorbic acid",11.54,0.1,10.93,239,"1 cup",29.9,"1 fl oz"
"Applesauce, canned, unsweetened, without added ascorbic acid (includes USDA commodity)",11.27,1.1,9.39,244,"1 cup",,
"Applesauce, canned, sweetened, without salt (includes USDA commodity)",17.49,1.2,14.67,246,"1 cup",,
"Apricots, raw",11.12,2,9.24,155,"1 cup,  halves",165,"1 cup, sliced"
"Apricots, canned, water pack, with skin, solids and liquids",6.39,1.6,4.79,243,"1 cup,  halves",36,"1 apricot, half with liquid"
"Apricots, canned, water pack, without skin, solids and liquids",5.48,1.1,,227,"1 cup, whole, without pits",,
"Apricots, canned, juice pack, with skin, solids and liquids",12.34,1.6,10.74,244,"1 cup,  halves",36,"1 apricot, half with liquid"
"Apricots, canned, extra light syrup pack, with skin, solids and liquids",12.5,1.6,,247,"1 cup,  halves",,
"Apricots, canned, light syrup pack, with skin, solids and liquids",16.49,1.6,14.89,253,"1 cup,  halves",40,"1 apricot, half with liquid"
"Apricots, canned, heavy syrup pack, with skin, solids and liquids",21.47,1.6,19.87,258,"1 cup,  halves",240,"1 cup, whole"
"Apricots, canned, heavy syrup pack, without skin, solids and liquids",21.45,1.6,,258,"1 cup, whole, without pits",,
"Apricots, canned, extra heavy syrup pack, without skin, solids and liquids",24.85,1.6,,246,"1 cup, whole, without pits",,
"Apricots, dehydrated (low-moisture), sulfured, uncooked",82.89,,,119,"1 cup",,
"Apricots, dehydrated (low-moisture), sulfured, stewed",32.62,,,249,"1 cup",,
"Apricots, dried, sulfured, uncooked",62.64,7.3,53.44,130,"1 cup,  halves",3.5,"1 half"
"Apricots, dried, sulfured, stewed, without added sugar",22.15,2.6,19.57,250,"1 cup,  halves",,
"Apricots, dried, sulfured, stewed, with added sugar",29.26,4.1,,270,"1 cup,  halves",,
"Apricots, frozen, sweetened",25.1,2.2,,242,"1 cup",,
"Apricot nectar, canned, without added ascorbic acid",14.39,0.6,13.79,251,"1 cup",31.4,"1 fl oz"
"Avocados, raw, all commercial varieties",8.53,6.7,0.66,150,"1 cup, cubes",230,"1 cup, pureed"
"Avocados, raw, California",8.64,6.8,0.3,230,"1 cup, pureed",136,"1 fruit, without skin and seed"
"Avocados, raw, Florida",7.82,5.6,2.42,230,"1 cup, pureed",304,"1 fruit, without skin and seeds"
"Bananas, raw",22.84,2.6,12.23,225,"1 cup, mashed",150,"1 cup, sliced"
"Bananas, dehydrated, or banana powder",88.28,9.9,47.3,100,"1 cup",6.2,"1 tbsp"
"Blackberries, raw",9.61,5.3,4.88,144,"1 cup",,
"Blackberry juice, canned",7.8,0.1,7.7,250,"1 cup",,
"Blackberries, canned, heavy syrup, solids and liquids",23.1,3.4,19.7,256,"1 cup",,
"Blackberries, frozen, unsweetened",15.67,5,10.67,151,"1 cup, unthawed",510,"1 package,  (18 oz)"
"Blueberries, raw",14.49,2.4,9.96,148,"1 cup",68,"50 berries"
"Blueberries, canned, heavy syrup, solids and liquids",22.06,1.6,20.46,256,"1 cup",,
"Blueberries, wild, frozen",13.85,4.4,,140,"1 cup, frozen",,
"Blueberries, frozen, unsweetened",12.17,2.7,8.45,155,"1 cup, unthawed",567,"1 package,  (20 oz)"
"Blueberries, frozen, sweetened",21.95,2.2,19.72,230,"1 cup, thawed",284,"1 package,  (10 oz)"
"Boysenberries, canned, heavy syrup",22.31,2.6,,256,"1 cup",,
"Boysenberries, frozen, unsweetened",12.19,5.3,6.89,132,"1 cup, unthawed",284,"1 package,  (10 oz)"
"Breadfruit, raw",27.12,4.9,11,220,"1 cup",96,".25 fruit,  small"
"Carambola, (starfruit), raw",6.73,2.8,3.98,132,"1 cup, cubes",108,"1 cup, sliced"
"Carissa, (natal-plum), raw",13.63,,,150,"1 cup, slices",20,"1 fruit, without skin and seeds"
"Cherimoya, raw",17.71,3,12.87,235,"1 fruit, without skin and seeds",160,"1 cup, pieces"
"Cherries, sour, red, raw",12.18,1.6,8.49,155,"1 cup, without pits",103,"1 cup, with pits yields"
"Cherries, sour, red, canned, water pack, solids and liquids (includes USDA commodity red tart cherries, canned)",8.94,1.1,7.6,244,"1 cup",,
"Cherries, sour, red, canned, light syrup pack, solids and liquids",19.3,0.8,,252,"1 cup",,
"Cherries, sour, red, canned, heavy syrup pack, solids and liquids",23.27,1.1,22.17,256,"1 cup",,
"Cherries, sour, red, canned, extra heavy syrup pack, solids and liquids",29.23,0.8,,261,"1 cup",,
"Cherries, sour, red, frozen, unsweetened",11.02,1.6,9.02,155,"1 cup, unthawed",510,"1 package,  (18 oz)"
"Cherries, sweet, raw",16.01,2.1,12.82,138,"1 cup, with pits yields",154,"1 cup, without pits"
"Cherries, sweet, canned, water pack, solids and liquids",11.76,1.5,10.26,248,"1 cup,  pitted",,
"Cherries, sweet, canned, juice pack, solids and liquids",13.81,1.5,12.31,250,"1 cup, pitted",,
"Cherries, sweet, canned, light syrup pack, solids and liquids",17.29,1.5,15.79,252,"1 cup, pitted",,
"Cherries, sweet, canned, pitted, heavy syrup pack, solids and liquids",21.27,1.4,16.18,253,"1 cup",,
"Cherries, sweet, canned, extra heavy syrup pack, solids and liquids",26.23,1.5,,261,"1 cup,  pitted",,
"Cherries, sweet, frozen, sweetened",22.36,2.1,20.26,259,"1 cup, thawed",284,"1 package,  (10 oz)"
"Crabapples, raw",19.95,,,110,"1 cup, slices",,
"Cranberries, raw",12.2,4.6,4.04,110,"1 cup, chopped",100,"1 cup, whole"
"Cranberries, dried, sweetened",82.36,5.7,65,40,".33 cup",,
"Cranberry sauce, canned, sweetened",38.9,1,37.9,277,"1 cup",57,"1 slice,  (1/2"" thick, approx 8 slices per can)"
"Cranberry-orange relish, canned",46.2,0,,275,"1 cup",,
"Currants, european black, raw",15.38,,,112,"1 cup",,
"Currants, red and white, raw",13.8,4.3,7.37,112,"1 cup",,
"Currants, zante, dried",74.08,6.8,67.28,144,"1 cup",,
"Custard-apple, (bullock's-heart), raw",25.2,2.4,,,,,
"Dates, deglet noor",75.03,8,63.35,147,"1 cup, chopped",7.1,"1 date, pitted"
"Elderberries, raw",18.4,7,,145,"1 cup",,
"Figs, raw",19.18,2.9,16.26,64,"1 large,  (2-1/2"" dia)",50,"1 medium,  (2-1/4"" dia)"
"Figs, canned, water pack, solids and liquids",13.99,2.2,11.79,248,"1 cup",27,"1 fig, with liquid"
"Figs, canned, light syrup pack, solids and liquids",17.95,1.8,16.15,252,"1 cup",28,"1 fig, with liquid"
"Figs, canned, heavy syrup pack, solids and liquids",22.9,2.2,20.7,259,"1 cup",28,"1 fig, with liquid"
"Figs, canned, extra heavy syrup pack, solids and liquids",27.86,,,261,"1 cup",,
"Figs, dried, uncooked",63.87,9.8,47.92,149,"1 cup",8.4,"1 fig"
"Figs, dried, stewed",27.57,4.2,23.35,259,"1 cup",,
"Fruit cocktail, (peach and pineapple and pear and grape and cherry), canned, water pack, solids and liquids",8.51,1,7.51,237,"1 cup",,
"Fruit cocktail, (peach and pineapple and pear and grape and cherry), canned, juice pack, solids and liquids",11.86,1,10.86,237,"1 cup",,
"Fruit cocktail, (peach and pineapple and pear and grape and cherry), canned, extra light syrup, solids and liquids",11.63,1.1,,123,".5 cup",,
"Fruit cocktail, (peach and pineapple and pear and grape and cherry), canned, light syrup, solids and liquids",14.93,1,13.93,242,"1 cup",,
"Fruit cocktail, (peach and pineapple and pear and grape and cherry), canned, heavy syrup, solids and liquids",18.91,1,17.91,248,"1 cup",,
"Fruit cocktail, (peach and pineapple and pear and grape and cherry), canned, extra heavy syrup, solids and liquids",22.89,1.1,,260,"1 cup",130,".5 cup"
"Fruit salad, (peach and pear and apricot and pineapple and cherry), canned, water pack, solids and liquids",7.87,1,,245,"1 cup",,
"Fruit salad, (peach and pear and apricot and pineapple and cherry), canned, juice pack, solids and liquids",13.05,1,,249,"1 cup",,
"Fruit salad, (peach and pear and apricot and pineapple and cherry), canned, light syrup, solids and liquids",15.14,1,,252,"1 cup",,
"Fruit salad, (peach and pear and apricot and pineapple and cherry), canned, heavy syrup, solids and liquids",19.11,1,18.11,255,"1 cup",,
